Resume,TECHNICAL_SKILL,COMPANY_NAME,TOOL,EDUCATION,EXPERIENCE,DESIGNATION,LOCATION,LANGUAGE,SOFT_SKILL,PAY,CERTIFICATION
"Experienced Product Manager, Software Engineer, Backend Developer, DevOps Engineer professional with expertise in Docker, TensorFlow, Python and hands-on experience with VS Code, Salesforce. Holding Bachelor's in Computer Science, Master's in Information Systems with 2+ years, Mid-Senior level, 7+ years of work experience. Previously worked at Google, Netflix, Microsoft located in New York, NY, Boston, MA, Seattle, WA. Fluent in Spanish, French with strong Problem-Solving, Communication Skills. Certified in AWS Certified Solutions Architect, Google Cloud Professional. Seeking new opportunities with an expected salary around $90k–$120k, $80k–$100k, $120k–$150k, $100k–$130k.","Docker, TensorFlow, Python","Google, Netflix, Microsoft","VS Code, Salesforce","Bachelor's in Computer Science, Master's in Information Systems","2+ years, Mid-Senior level, 7+ years","Product Manager, Software Engineer, Backend Developer, DevOps Engineer","New York, NY, Boston, MA, Seattle, WA","Spanish, French","Problem-Solving, Communication Skills","$90k–$120k, $80k–$100k, $120k–$150k, $100k–$130k","AWS Certified Solutions Architect, Google Cloud Professional"
"Experienced Data Scientist, Product Manager, Software Engineer professional with expertise in Python, Java and hands-on experience with Salesforce, Jira, VS Code. Holding Master's in Information Systems, Ph.D. in Data Science, Bachelor's in Computer Science with 2+ years, 7+ years of work experience. Previously worked at Apple, Google located in Boston, MA, New York, NY. Fluent in Spanish, English with strong Adaptability, Leadership, Communication Skills, Teamwork. Certified in PMP Certification, AWS Certified Solutions Architect, Google Cloud Professional. Seeking new opportunities with an expected salary around $120k–$150k, $90k–$120k, $100k–$130k, $80k–$100k.","Python, Java","Apple, Google","Salesforce, Jira, VS Code","Master's in Information Systems, Ph.D. in Data Science, Bachelor's in Computer Science","2+ years, 7+ years","Data Scientist, Product Manager, Software Engineer","Boston, MA, New York, NY","Spanish, English","Adaptability, Leadership, Communication Skills, Teamwork","$120k–$150k, $90k–$120k, $100k–$130k, $80k–$100k","PMP Certification, AWS Certified Solutions Architect, Google Cloud Professional"
"Experienced Software Engineer, Data Scientist professional with expertise in Java, Python, Kubernetes and hands-on experience with Salesforce, Figma. Holding Ph.D. in Data Science, Bachelor's in Computer Science, Master's in Information Systems with 3-5 years, 7+ years, 5+ years of work experience. Previously worked at Microsoft, Google located in New York, NY, Austin, TX, San Francisco, CA. Fluent in German, Spanish with strong Leadership, Communication Skills, Adaptability, Teamwork. Certified in Google Cloud Professional, PMP Certification. Seeking new opportunities with an expected salary around $80k–$100k, $90k–$120k, $100k–$130k.","Java, Python, Kubernetes","Microsoft, Google","Salesforce, Figma","Ph.D. in Data Science, Bachelor's in Computer Science, Master's in Information Systems","3-5 years, 7+ years, 5+ years","Software Engineer, Data Scientist","New York, NY, Austin, TX, San Francisco, CA","German, Spanish","Leadership, Communication Skills, Adaptability, Teamwork","$80k–$100k, $90k–$120k, $100k–$130k","Google Cloud Professional, PMP Certification"
"Experienced Product Manager, Backend Developer, Data Scientist professional with expertise in Kubernetes, Python and hands-on experience with Slack, Tableau, GitHub. Holding Master's in Information Systems, Ph.D. in Data Science, Bachelor's in Computer Science with 2+ years, 7+ years, Entry level, 3-5 years of work experience. Previously worked at Google, IBM located in Boston, MA, Seattle, WA, Chicago, IL, Austin, TX. Fluent in Spanish, French with strong Adaptability, Leadership. Certified in Google Cloud Professional, AWS Certified Solutions Architect, PMP Certification, Certified Scrum Master. Seeking new opportunities with an expected salary around $120k–$150k, $80k–$100k, $90k–$120k, $100k–$130k.","Kubernetes, Python","Google, IBM","Slack, Tableau, GitHub","Master's in Information Systems, Ph.D. in Data Science, Bachelor's in Computer Science","2+ years, 7+ years, Entry level, 3-5 years","Product Manager, Backend Developer, Data Scientist","Boston, MA, Seattle, WA, Chicago, IL, Austin, TX","Spanish, French","Adaptability, Leadership","$120k–$150k, $80k–$100k, $90k–$120k, $100k–$130k","Google Cloud Professional, AWS Certified Solutions Architect, PMP Certification, Certified Scrum Master"
"Experienced Software Engineer, Data Scientist, Backend Developer, DevOps Engineer professional with expertise in AWS, Kubernetes and hands-on experience with Tableau, Slack, Salesforce, Jira. Holding Ph.D. in Data Science, Bachelor's in Computer Science, Master's in Information Systems with 5+ years, 7+ years, 2+ years of work experience. Previously worked at IBM, Microsoft located in Austin, TX, Boston, MA, New York, NY, Seattle, WA. Fluent in Spanish, French with strong Teamwork, Adaptability, Communication Skills, Leadership. Certified in Google Cloud Professional, PMP Certification, Certified Scrum Master, AWS Certified Solutions Architect. Seeking new opportunities with an expected salary around $100k–$130k, $90k–$120k, $120k–$150k, $80k–$100k.","AWS, Kubernetes","IBM, Microsoft","Tableau, Slack, Salesforce, Jira","Ph.D. in Data Science, Bachelor's in Computer Science, Master's in Information Systems","5+ years, 7+ years, 2+ years","Software Engineer, Data Scientist, Backend Developer, DevOps Engineer","Austin, TX, Boston, MA, New York, NY, Seattle, WA","Spanish, French","Teamwork, Adaptability, Communication Skills, Leadership","$100k–$130k, $90k–$120k, $120k–$150k, $80k–$100k","Google Cloud Professional, PMP Certification, Certified Scrum Master, AWS Certified Solutions Architect"
"Experienced Backend Developer, DevOps Engineer, Software Engineer, Data Scientist professional with expertise in Machine Learning, Kubernetes, Python and hands-on experience with GitHub, Salesforce. Holding Ph.D. in Data Science, Master's in Information Systems, Bachelor's in Computer Science with Entry level, 7+ years of work experience. Previously worked at Facebook, Tesla, Netflix located in Boston, MA, Seattle, WA, San Francisco, CA, New York, NY. Fluent in English, Spanish, French, German with strong Leadership, Teamwork, Communication Skills. Certified in PMP Certification, Google Cloud Professional, Certified Scrum Master. Seeking new opportunities with an expected salary around $100k–$130k, $90k–$120k.","Machine Learning, Kubernetes, Python","Facebook, Tesla, Netflix","GitHub, Salesforce","Ph.D. in Data Science, Master's in Information Systems, Bachelor's in Computer Science","Entry level, 7+ years","Backend Developer, DevOps Engineer, Software Engineer, Data Scientist","Boston, MA, Seattle, WA, San Francisco, CA, New York, NY","English, Spanish, French, German","Leadership, Teamwork, Communication Skills","$100k–$130k, $90k–$120k","PMP Certification, Google Cloud Professional, Certified Scrum Master"
"Experienced Product Manager, Data Scientist professional with expertise in Docker, SQL, TensorFlow and hands-on experience with VS Code, Tableau, Salesforce. Holding Bachelor's in Computer Science, Master's in Information Systems, Ph.D. in Data Science with Mid-Senior level, 7+ years of work experience. Previously worked at Apple, Netflix located in Seattle, WA, Boston, MA, San Francisco, CA. Fluent in French, German with strong Problem-Solving, Leadership, Communication Skills. Certified in PMP Certification, Google Cloud Professional, AWS Certified Solutions Architect, Certified Scrum Master. Seeking new opportunities with an expected salary around $120k–$150k, $90k–$120k.","Docker, SQL, TensorFlow","Apple, Netflix","VS Code, Tableau, Salesforce","Bachelor's in Computer Science, Master's in Information Systems, Ph.D. in Data Science","Mid-Senior level, 7+ years","Product Manager, Data Scientist","Seattle, WA, Boston, MA, San Francisco, CA","French, German","Problem-Solving, Leadership, Communication Skills","$120k–$150k, $90k–$120k","PMP Certification, Google Cloud Professional, AWS Certified Solutions Architect, Certified Scrum Master"
"Experienced Software Engineer, Backend Developer professional with expertise in Kubernetes, Java, AWS and hands-on experience with Jira, Tableau. Holding Ph.D. in Data Science, Master's in Information Systems, Bachelor's in Computer Science with 5+ years, 3-5 years, Mid-Senior level of work experience. Previously worked at Netflix, Google located in Chicago, IL, Boston, MA, San Francisco, CA. Fluent in French, English, Spanish with strong Adaptability, Problem-Solving, Leadership. Certified in AWS Certified Solutions Architect, Certified Scrum Master, Google Cloud Professional. Seeking new opportunities with an expected salary around $100k–$130k, $80k–$100k, $120k–$150k.","Kubernetes, Java, AWS","Netflix, Google","Jira, Tableau","Ph.D. in Data Science, Master's in Information Systems, Bachelor's in Computer Science","5+ years, 3-5 years, Mid-Senior level","Software Engineer, Backend Developer","Chicago, IL, Boston, MA, San Francisco, CA","French, English, Spanish","Adaptability, Problem-Solving, Leadership","$100k–$130k, $80k–$100k, $120k–$150k","AWS Certified Solutions Architect, Certified Scrum Master, Google Cloud Professional"
"Experienced DevOps Engineer, Product Manager, Backend Developer, Data Scientist professional with expertise in Python, AWS, Docker and hands-on experience with Salesforce, Tableau. Holding Bachelor's in Computer Science, Master's in Information Systems, Ph.D. in Data Science with 2+ years, 7+ years, Mid-Senior level of work experience. Previously worked at Tesla, Amazon, Netflix located in Boston, MA, Chicago, IL, New York, NY, San Francisco, CA. Fluent in English, French, Spanish with strong Problem-Solving, Leadership. Certified in PMP Certification, AWS Certified Solutions Architect. Seeking new opportunities with an expected salary around $100k–$130k, $120k–$150k, $80k–$100k.","Python, AWS, Docker","Tesla, Amazon, Netflix","Salesforce, Tableau","Bachelor's in Computer Science, Master's in Information Systems, Ph.D. in Data Science","2+ years, 7+ years, Mid-Senior level","DevOps Engineer, Product Manager, Backend Developer, Data Scientist","Boston, MA, Chicago, IL, New York, NY, San Francisco, CA","English, French, Spanish","Problem-Solving, Leadership","$100k–$130k, $120k–$150k, $80k–$100k","PMP Certification, AWS Certified Solutions Architect"
"Experienced Data Scientist, Backend Developer, Product Manager professional with expertise in TensorFlow, Kubernetes, Machine Learning and hands-on experience with Salesforce, Figma, Slack, GitHub. Holding Ph.D. in Data Science, Master's in Information Systems, Bachelor's in Computer Science with 3-5 years, Mid-Senior level, 2+ years of work experience. Previously worked at Netflix, Apple, Google located in New York, NY, Seattle, WA, Austin, TX, San Francisco, CA. Fluent in German, French, English with strong Teamwork, Adaptability. Certified in Certified Scrum Master, AWS Certified Solutions Architect, PMP Certification. Seeking new opportunities with an expected salary around $120k–$150k, $80k–$100k, $90k–$120k.","TensorFlow, Kubernetes, Machine Learning","Netflix, Apple, Google","Salesforce, Figma, Slack, GitHub","Ph.D. in Data Science, Master's in Information Systems, Bachelor's in Computer Science","3-5 years, Mid-Senior level, 2+ years","Data Scientist, Backend Developer, Product Manager","New York, NY, Seattle, WA, Austin, TX, San Francisco, CA","German, French, English","Teamwork, Adaptability","$120k–$150k, $80k–$100k, $90k–$120k","Certified Scrum Master, AWS Certified Solutions Architect, PMP Certification"
"Experienced Backend Developer, Product Manager, DevOps Engineer, Software Engineer professional with expertise in Java, Machine Learning, AWS and hands-on experience with Figma, Tableau, Slack, GitHub. Holding Bachelor's in Computer Science, Ph.D. in Data Science, Master's in Information Systems with 2+ years, 5+ years, 3-5 years of work experience. Previously worked at Apple, Google, Amazon, Facebook located in New York, NY, Chicago, IL, Seattle, WA. Fluent in French, Spanish, English with strong Teamwork, Adaptability, Problem-Solving. Certified in AWS Certified Solutions Architect, PMP Certification, Google Cloud Professional, Certified Scrum Master. Seeking new opportunities with an expected salary around $90k–$120k, $100k–$130k, $80k–$100k, $120k–$150k.","Java, Machine Learning, AWS","Apple, Google, Amazon, Facebook","Figma, Tableau, Slack, GitHub","Bachelor's in Computer Science, Ph.D. in Data Science, Master's in Information Systems","2+ years, 5+ years, 3-5 years","Backend Developer, Product Manager, DevOps Engineer, Software Engineer","New York, NY, Chicago, IL, Seattle, WA","French, Spanish, English","Teamwork, Adaptability, Problem-Solving","$90k–$120k, $100k–$130k, $80k–$100k, $120k–$150k","AWS Certified Solutions Architect, PMP Certification, Google Cloud Professional, Certified Scrum Master"
"Experienced Product Manager, DevOps Engineer professional with expertise in TensorFlow, Python, AWS, Machine Learning and hands-on experience with Jira, VS Code. Holding Ph.D. in Data Science, Master's in Information Systems with Entry level, Mid-Senior level, 7+ years, 5+ years of work experience. Previously worked at Amazon, IBM, Tesla located in New York, NY, Seattle, WA, Chicago, IL, San Francisco, CA. Fluent in English, German with strong Leadership, Communication Skills, Teamwork, Problem-Solving. Certified in PMP Certification, Certified Scrum Master, AWS Certified Solutions Architect, Google Cloud Professional. Seeking new opportunities with an expected salary around $80k–$100k, $100k–$130k.","TensorFlow, Python, AWS, Machine Learning","Amazon, IBM, Tesla","Jira, VS Code","Ph.D. in Data Science, Master's in Information Systems","Entry level, Mid-Senior level, 7+ years, 5+ years","Product Manager, DevOps Engineer","New York, NY, Seattle, WA, Chicago, IL, San Francisco, CA","English, German","Leadership, Communication Skills, Teamwork, Problem-Solving","$80k–$100k, $100k–$130k","PMP Certification, Certified Scrum Master, AWS Certified Solutions Architect, Google Cloud Professional"
"Experienced Product Manager, Data Scientist professional with expertise in AWS, Python, TensorFlow, Docker and hands-on experience with Tableau, Jira, Slack. Holding Bachelor's in Computer Science, Ph.D. in Data Science with Entry level, Mid-Senior level of work experience. Previously worked at Google, Apple located in New York, NY, San Francisco, CA. Fluent in French, English, German, Spanish with strong Leadership, Problem-Solving. Certified in AWS Certified Solutions Architect, Certified Scrum Master, Google Cloud Professional. Seeking new opportunities with an expected salary around $100k–$130k, $80k–$100k.","AWS, Python, TensorFlow, Docker","Google, Apple","Tableau, Jira, Slack","Bachelor's in Computer Science, Ph.D. in Data Science","Entry level, Mid-Senior level","Product Manager, Data Scientist","New York, NY, San Francisco, CA","French, English, German, Spanish","Leadership, Problem-Solving","$100k–$130k, $80k–$100k","AWS Certified Solutions Architect, Certified Scrum Master, Google Cloud Professional"
"Experienced Product Manager, DevOps Engineer professional with expertise in Java, SQL, TensorFlow, Kubernetes and hands-on experience with Tableau, GitHub, Figma. Holding Master's in Information Systems, Bachelor's in Computer Science with 2+ years, 7+ years, 5+ years, Entry level of work experience. Previously worked at Microsoft, Facebook, Apple located in Boston, MA, San Francisco, CA, Austin, TX, Seattle, WA. Fluent in Spanish, German, French, English with strong Adaptability, Problem-Solving. Certified in Google Cloud Professional, PMP Certification, Certified Scrum Master, AWS Certified Solutions Architect. Seeking new opportunities with an expected salary around $100k–$130k, $90k–$120k.","Java, SQL, TensorFlow, Kubernetes","Microsoft, Facebook, Apple","Tableau, GitHub, Figma","Master's in Information Systems, Bachelor's in Computer Science","2+ years, 7+ years, 5+ years, Entry level","Product Manager, DevOps Engineer","Boston, MA, San Francisco, CA, Austin, TX, Seattle, WA","Spanish, German, French, English","Adaptability, Problem-Solving","$100k–$130k, $90k–$120k","Google Cloud Professional, PMP Certification, Certified Scrum Master, AWS Certified Solutions Architect"
"Experienced Backend Developer, DevOps Engineer, Software Engineer professional with expertise in Machine Learning, Java, SQL, AWS and hands-on experience with Figma, Tableau, Jira. Holding Bachelor's in Computer Science, Master's in Information Systems, Ph.D. in Data Science with 7+ years, Mid-Senior level, 2+ years of work experience. Previously worked at Google, Apple, Facebook, Amazon located in New York, NY, Seattle, WA. Fluent in German, Spanish, English, French with strong Adaptability, Leadership, Problem-Solving, Communication Skills. Certified in Certified Scrum Master, AWS Certified Solutions Architect, PMP Certification, Google Cloud Professional. Seeking new opportunities with an expected salary around $100k–$130k, $90k–$120k.","Machine Learning, Java, SQL, AWS","Google, Apple, Facebook, Amazon","Figma, Tableau, Jira","Bachelor's in Computer Science, Master's in Information Systems, Ph.D. in Data Science","7+ years, Mid-Senior level, 2+ years","Backend Developer, DevOps Engineer, Software Engineer","New York, NY, Seattle, WA","German, Spanish, English, French","Adaptability, Leadership, Problem-Solving, Communication Skills","$100k–$130k, $90k–$120k","Certified Scrum Master, AWS Certified Solutions Architect, PMP Certification, Google Cloud Professional"
"Experienced Backend Developer, Data Scientist professional with expertise in Docker, AWS, Java, Python and hands-on experience with Tableau, Slack. Holding Master's in Information Systems, Bachelor's in Computer Science with 3-5 years, 5+ years, 7+ years of work experience. Previously worked at Apple, IBM, Facebook located in Chicago, IL, San Francisco, CA, New York, NY, Austin, TX. Fluent in English, German with strong Leadership, Communication Skills. Certified in PMP Certification, Certified Scrum Master. Seeking new opportunities with an expected salary around $80k–$100k, $90k–$120k, $120k–$150k.","Docker, AWS, Java, Python","Apple, IBM, Facebook","Tableau, Slack","Master's in Information Systems, Bachelor's in Computer Science","3-5 years, 5+ years, 7+ years","Backend Developer, Data Scientist","Chicago, IL, San Francisco, CA, New York, NY, Austin, TX","English, German","Leadership, Communication Skills","$80k–$100k, $90k–$120k, $120k–$150k","PMP Certification, Certified Scrum Master"
"Experienced Product Manager, Software Engineer professional with expertise in Machine Learning, Python and hands-on experience with Figma, Salesforce. Holding Master's in Information Systems, Bachelor's in Computer Science with 2+ years, 3-5 years of work experience. Previously worked at Facebook, IBM, Amazon, Netflix located in Chicago, IL, San Francisco, CA, Boston, MA. Fluent in Spanish, English, German with strong Problem-Solving, Teamwork, Communication Skills, Adaptability. Certified in Certified Scrum Master, Google Cloud Professional, PMP Certification, AWS Certified Solutions Architect. Seeking new opportunities with an expected salary around $90k–$120k, $100k–$130k, $80k–$100k, $120k–$150k.","Machine Learning, Python","Facebook, IBM, Amazon, Netflix","Figma, Salesforce","Master's in Information Systems, Bachelor's in Computer Science","2+ years, 3-5 years","Product Manager, Software Engineer","Chicago, IL, San Francisco, CA, Boston, MA","Spanish, English, German","Problem-Solving, Teamwork, Communication Skills, Adaptability","$90k–$120k, $100k–$130k, $80k–$100k, $120k–$150k","Certified Scrum Master, Google Cloud Professional, PMP Certification, AWS Certified Solutions Architect"
"Experienced Data Scientist, Backend Developer professional with expertise in SQL, Python, Docker, TensorFlow and hands-on experience with VS Code, Slack. Holding Master's in Information Systems, Ph.D. in Data Science with Entry level, 7+ years of work experience. Previously worked at Microsoft, Apple located in Chicago, IL, New York, NY. Fluent in English, Spanish, French with strong Leadership, Teamwork. Certified in PMP Certification, AWS Certified Solutions Architect, Certified Scrum Master, Google Cloud Professional. Seeking new opportunities with an expected salary around $120k–$150k, $90k–$120k, $80k–$100k, $100k–$130k.","SQL, Python, Docker, TensorFlow","Microsoft, Apple","VS Code, Slack","Master's in Information Systems, Ph.D. in Data Science","Entry level, 7+ years","Data Scientist, Backend Developer","Chicago, IL, New York, NY","English, Spanish, French","Leadership, Teamwork","$120k–$150k, $90k–$120k, $80k–$100k, $100k–$130k","PMP Certification, AWS Certified Solutions Architect, Certified Scrum Master, Google Cloud Professional"
"Experienced Product Manager, Data Scientist, Software Engineer professional with expertise in Python, AWS, Machine Learning and hands-on experience with Figma, VS Code. Holding Master's in Information Systems, Bachelor's in Computer Science with 3-5 years, Entry level of work experience. Previously worked at Apple, Microsoft, IBM, Netflix located in Boston, MA, New York, NY. Fluent in German, English with strong Communication Skills, Teamwork, Leadership, Problem-Solving. Certified in PMP Certification, Google Cloud Professional, Certified Scrum Master. Seeking new opportunities with an expected salary around $90k–$120k, $80k–$100k, $120k–$150k.","Python, AWS, Machine Learning","Apple, Microsoft, IBM, Netflix","Figma, VS Code","Master's in Information Systems, Bachelor's in Computer Science","3-5 years, Entry level","Product Manager, Data Scientist, Software Engineer","Boston, MA, New York, NY","German, English","Communication Skills, Teamwork, Leadership, Problem-Solving","$90k–$120k, $80k–$100k, $120k–$150k","PMP Certification, Google Cloud Professional, Certified Scrum Master"
"Experienced Data Scientist, Product Manager, DevOps Engineer professional with expertise in AWS, Docker, TensorFlow, Machine Learning and hands-on experience with Tableau, GitHub, Figma, VS Code. Holding Bachelor's in Computer Science, Ph.D. in Data Science, Master's in Information Systems with 2+ years, 7+ years of work experience. Previously worked at Tesla, Microsoft, Netflix, Apple located in Boston, MA, Seattle, WA, Chicago, IL. Fluent in German, English, French with strong Communication Skills, Problem-Solving. Certified in Google Cloud Professional, Certified Scrum Master, AWS Certified Solutions Architect, PMP Certification. Seeking new opportunities with an expected salary around $120k–$150k, $100k–$130k, $90k–$120k.","AWS, Docker, TensorFlow, Machine Learning","Tesla, Microsoft, Netflix, Apple","Tableau, GitHub, Figma, VS Code","Bachelor's in Computer Science, Ph.D. in Data Science, Master's in Information Systems","2+ years, 7+ years","Data Scientist, Product Manager, DevOps Engineer","Boston, MA, Seattle, WA, Chicago, IL","German, English, French","Communication Skills, Problem-Solving","$120k–$150k, $100k–$130k, $90k–$120k","Google Cloud Professional, Certified Scrum Master, AWS Certified Solutions Architect, PMP Certification"
"Experienced Data Scientist, DevOps Engineer, Product Manager professional with expertise in SQL, Machine Learning, Kubernetes and hands-on experience with Jira, Tableau, Salesforce, VS Code. Holding Ph.D. in Data Science, Bachelor's in Computer Science, Master's in Information Systems with 2+ years, 3-5 years, Mid-Senior level, Entry level of work experience. Previously worked at Tesla, Amazon located in New York, NY, Seattle, WA. Fluent in Spanish, French with strong Teamwork, Adaptability, Leadership, Problem-Solving. Certified in Certified Scrum Master, PMP Certification, AWS Certified Solutions Architect, Google Cloud Professional. Seeking new opportunities with an expected salary around $100k–$130k, $90k–$120k, $80k–$100k, $120k–$150k.","SQL, Machine Learning, Kubernetes","Tesla, Amazon","Jira, Tableau, Salesforce, VS Code","Ph.D. in Data Science, Bachelor's in Computer Science, Master's in Information Systems","2+ years, 3-5 years, Mid-Senior level, Entry level","Data Scientist, DevOps Engineer, Product Manager","New York, NY, Seattle, WA","Spanish, French","Teamwork, Adaptability, Leadership, Problem-Solving","$100k–$130k, $90k–$120k, $80k–$100k, $120k–$150k","Certified Scrum Master, PMP Certification, AWS Certified Solutions Architect, Google Cloud Professional"
