ResumeSkill,JobSkill,TentativeScore
"Mentorship, Stress Management, Adaptability, Patience","Collaboration, Stress Management, Empathy, Work Ethic, Effective Communication",0.3776
"Networking, Team Collaboration, Analytical Thinking, Negotiation, Patience","Mentorship, Collaboration, Time Management, Coaching, Empathy, Networking",0.4884
"Leadership, Work Ethic, Coaching, Critical Thinking, Emotional Intelligence","Effective Communication, Interpersonal Skills, Adaptability, Communication, Time Management, Stress Management",0.5512
"Decision Making, Analytical Thinking, Mentorship, Confidence, Adaptability","Mentorship, Collaboration, Active Listening, Confidence, Negotiation, Work Ethic",0.5415
"Confidence, Problem Solving, Creativity, Networking, Interpersonal Skills, Patience","Patience, Time Management, Problem Solving, Decision Making, Analytical Thinking",0.6241
"Team Collaboration, Teamwork, Emotional Intelligence","Conflict Resolution, Teamwork, Interpersonal Skills, Stress Management, Adaptability, Negotiation",0.502
"Teamwork, Effective Communication, Networking, Creativity, Problem Solving","Collaboration, Communication, Interpersonal Skills, Decision Making, Stress Management, Patience",0.718
"Active Listening, Work Ethic, Emotional Intelligence, Team Collaboration, Interpersonal Skills, Critical Thinking","Effective Communication, Stress Management, Patience",0.4603
"Adaptability, Teamwork, Time Management, Negotiation","Critical Thinking, Decision Making, Networking, Public Speaking, Problem Solving, Interpersonal Skills",0.908
"Empathy, Stress Management, Active Listening, Analytical Thinking, Public Speaking, Patience","Coaching, Public Speaking, Problem Solving",0.5939
"Conflict Resolution, Analytical Thinking, Stress Management, Problem Solving","Mentorship, Decision Making, Empathy, Collaboration",0.3714
"Time Management, Coaching, Creativity, Team Collaboration, Networking, Mentorship","Effective Communication, Interpersonal Skills, Patience, Collaboration",0.3394
"Problem Solving, Decision Making, Communication","Decision Making, Adaptability, Emotional Intelligence, Active Listening, Problem Solving, Critical Thinking",0.5724
"Analytical Thinking, Active Listening, Creativity, Mentorship, Patience","Active Listening, Communication, Problem Solving, Patience, Stress Management",0.4665
"Collaboration, Leadership, Public Speaking, Conflict Resolution, Problem Solving, Team Collaboration","Networking, Time Management, Active Listening, Empathy, Public Speaking",0.6071
"Work Ethic, Adaptability, Coaching, Networking, Active Listening, Creativity","Confidence, Negotiation, Teamwork, Networking, Coaching, Interpersonal Skills",0.571
"Collaboration, Leadership, Stress Management, Work Ethic","Interpersonal Skills, Communication, Coaching, Negotiation",0.4891
"Time Management, Critical Thinking, Conflict Resolution, Emotional Intelligence","Analytical Thinking, Teamwork, Time Management, Critical Thinking, Stress Management, Adaptability",0.373
"Time Management, Interpersonal Skills, Negotiation, Networking, Creativity, Critical Thinking","Empathy, Coaching, Adaptability, Work Ethic, Negotiation, Interpersonal Skills",0.2728
"Analytical Thinking, Decision Making, Negotiation","Problem Solving, Empathy, Analytical Thinking, Teamwork",0.433
"Adaptability, Analytical Thinking, Team Collaboration, Patience","Collaboration, Teamwork, Negotiation",0.6285
"Critical Thinking, Confidence, Networking, Leadership, Analytical Thinking, Coaching","Coaching, Team Collaboration, Conflict Resolution",0.5321
"Teamwork, Confidence, Communication, Collaboration","Interpersonal Skills, Communication, Effective Communication",0.3131
"Negotiation, Collaboration, Teamwork, Critical Thinking, Mentorship","Empathy, Confidence, Public Speaking",0.526
"Decision Making, Creativity, Coaching, Critical Thinking","Negotiation, Communication, Conflict Resolution",0.5578
"Communication, Empathy, Collaboration, Adaptability","Work Ethic, Coaching, Mentorship, Effective Communication, Confidence",0.3674
"Time Management, Active Listening, Effective Communication","Collaboration, Confidence, Emotional Intelligence, Decision Making, Analytical Thinking, Time Management",0.5231
"Time Management, Adaptability, Critical Thinking","Active Listening, Effective Communication, Mentorship, Public Speaking",0.5087
"Coaching, Collaboration, Emotional Intelligence","Public Speaking, Coaching, Conflict Resolution, Creativity, Time Management",0.3286
"Empathy, Leadership, Communication, Adaptability, Work Ethic","Patience, Effective Communication, Interpersonal Skills",0.5537
"Negotiation, Patience, Public Speaking","Conflict Resolution, Time Management, Confidence, Mentorship",0.5841
"Public Speaking, Empathy, Patience, Teamwork, Adaptability, Analytical Thinking","Collaboration, Patience, Decision Making, Empathy, Time Management",0.6625
"Work Ethic, Public Speaking, Effective Communication, Problem Solving, Coaching","Stress Management, Collaboration, Networking, Creativity",0.6581
"Negotiation, Confidence, Effective Communication","Effective Communication, Collaboration, Patience, Critical Thinking, Interpersonal Skills",0.2933
"Problem Solving, Creativity, Public Speaking, Time Management, Conflict Resolution, Collaboration","Adaptability, Active Listening, Empathy",0.3593
"Adaptability, Negotiation, Coaching","Collaboration, Negotiation, Decision Making, Active Listening, Problem Solving, Communication",0.5773
"Coaching, Interpersonal Skills, Critical Thinking","Collaboration, Communication, Patience, Time Management, Confidence, Emotional Intelligence",0.5771
"Conflict Resolution, Work Ethic, Patience, Effective Communication","Decision Making, Teamwork, Analytical Thinking, Public Speaking",0.5773
"Conflict Resolution, Public Speaking, Patience","Empathy, Communication, Stress Management, Adaptability, Coaching",1.0
"Communication, Empathy, Patience, Conflict Resolution, Leadership, Networking","Stress Management, Empathy, Mentorship, Patience, Conflict Resolution, Creativity",0.5856
"Work Ethic, Communication, Adaptability, Teamwork, Effective Communication","Problem Solving, Coaching, Creativity, Leadership, Effective Communication, Confidence",0.6703
"Active Listening, Teamwork, Collaboration, Negotiation, Conflict Resolution, Time Management","Stress Management, Work Ethic, Interpersonal Skills, Conflict Resolution, Effective Communication, Patience",0.6431
"Effective Communication, Active Listening, Time Management, Emotional Intelligence, Patience, Negotiation","Creativity, Team Collaboration, Networking, Interpersonal Skills, Problem Solving, Stress Management",0.5977
"Conflict Resolution, Communication, Work Ethic, Interpersonal Skills, Team Collaboration","Patience, Emotional Intelligence, Stress Management, Negotiation, Public Speaking, Creativity",0.4527
"Mentorship, Confidence, Collaboration, Public Speaking","Effective Communication, Mentorship, Time Management",0.6138
"Networking, Team Collaboration, Effective Communication","Creativity, Leadership, Public Speaking, Collaboration, Patience, Coaching",0.3841
"Communication, Decision Making, Work Ethic, Active Listening","Coaching, Emotional Intelligence, Active Listening, Empathy, Mentorship, Collaboration",0.4645
"Confidence, Mentorship, Coaching","Conflict Resolution, Analytical Thinking, Emotional Intelligence, Problem Solving, Patience",0.4272
"Creativity, Empathy, Teamwork, Team Collaboration, Time Management","Problem Solving, Teamwork, Empathy, Active Listening, Conflict Resolution, Mentorship",0.5123
"Adaptability, Decision Making, Networking, Confidence","Communication, Coaching, Patience, Creativity, Time Management, Decision Making",0.8472
"Analytical Thinking, Confidence, Creativity, Problem Solving, Public Speaking, Empathy","Networking, Time Management, Public Speaking, Empathy",0.2199
"Patience, Analytical Thinking, Team Collaboration","Networking, Coaching, Teamwork, Conflict Resolution, Adaptability",0.6029
"Stress Management, Negotiation, Active Listening, Confidence","Stress Management, Emotional Intelligence, Time Management",0.2581
"Patience, Negotiation, Stress Management","Analytical Thinking, Mentorship, Team Collaboration, Empathy, Effective Communication, Negotiation",0.4292
"Effective Communication, Mentorship, Conflict Resolution, Public Speaking","Negotiation, Problem Solving, Interpersonal Skills, Empathy",0.6633
"Confidence, Patience, Mentorship, Problem Solving, Teamwork, Communication","Empathy, Adaptability, Team Collaboration",0.5096
"Coaching, Active Listening, Collaboration","Mentorship, Decision Making, Conflict Resolution, Emotional Intelligence",0.3383
"Decision Making, Coaching, Team Collaboration, Adaptability","Coaching, Stress Management, Emotional Intelligence, Adaptability",0.3927
"Critical Thinking, Collaboration, Leadership, Time Management, Conflict Resolution","Effective Communication, Negotiation, Stress Management, Leadership",0.6019
"Collaboration, Empathy, Stress Management","Emotional Intelligence, Empathy, Patience, Work Ethic, Creativity, Team Collaboration",0.3904
"Active Listening, Creativity, Adaptability, Teamwork","Networking, Stress Management, Negotiation, Effective Communication, Mentorship",0.5325
"Effective Communication, Communication, Interpersonal Skills","Time Management, Conflict Resolution, Patience, Leadership",0.5068
"Public Speaking, Effective Communication, Emotional Intelligence, Negotiation, Creativity, Interpersonal Skills","Effective Communication, Public Speaking, Analytical Thinking, Adaptability, Critical Thinking, Communication",0.4023
"Mentorship, Teamwork, Stress Management","Creativity, Collaboration, Patience",0.8216
"Decision Making, Work Ethic, Coaching, Critical Thinking","Networking, Problem Solving, Team Collaboration",0.5951
"Adaptability, Teamwork, Stress Management, Patience","Decision Making, Time Management, Communication",0.1962
"Creativity, Negotiation, Active Listening, Analytical Thinking, Adaptability, Stress Management","Interpersonal Skills, Collaboration, Empathy, Teamwork, Problem Solving, Patience",0.528
"Creativity, Leadership, Work Ethic","Mentorship, Problem Solving, Creativity",0.4007
"Critical Thinking, Conflict Resolution, Confidence, Problem Solving, Teamwork, Decision Making","Team Collaboration, Creativity, Interpersonal Skills, Effective Communication, Negotiation",0.6279
"Time Management, Analytical Thinking, Leadership, Collaboration, Public Speaking","Time Management, Critical Thinking, Mentorship, Negotiation",0.3811
"Negotiation, Mentorship, Analytical Thinking, Adaptability, Interpersonal Skills","Creativity, Time Management, Effective Communication, Negotiation, Leadership",0.4828
"Leadership, Coaching, Teamwork","Confidence, Conflict Resolution, Active Listening",0.5757
"Interpersonal Skills, Critical Thinking, Time Management","Analytical Thinking, Collaboration, Emotional Intelligence, Public Speaking, Work Ethic, Effective Communication",0.6299
"Public Speaking, Confidence, Collaboration","Negotiation, Public Speaking, Communication, Work Ethic, Collaboration, Problem Solving",0.32
"Critical Thinking, Mentorship, Interpersonal Skills, Work Ethic, Creativity","Empathy, Patience, Analytical Thinking, Collaboration, Decision Making, Coaching",0.4498
"Critical Thinking, Active Listening, Communication, Coaching, Interpersonal Skills","Patience, Team Collaboration, Mentorship, Teamwork, Creativity",0.4288
"Time Management, Negotiation, Decision Making, Public Speaking, Patience, Mentorship","Decision Making, Adaptability, Coaching",0.402
"Decision Making, Collaboration, Patience, Communication, Stress Management, Critical Thinking","Emotional Intelligence, Collaboration, Coaching, Work Ethic, Leadership",0.7648
"Leadership, Collaboration, Confidence, Emotional Intelligence, Conflict Resolution, Teamwork","Conflict Resolution, Negotiation, Work Ethic, Teamwork, Effective Communication, Mentorship",0.5607
"Empathy, Negotiation, Active Listening, Collaboration","Collaboration, Work Ethic, Leadership, Time Management, Mentorship, Interpersonal Skills",0.3109
"Critical Thinking, Time Management, Empathy","Stress Management, Emotional Intelligence, Collaboration, Patience",0.6377
"Analytical Thinking, Networking, Team Collaboration","Mentorship, Stress Management, Adaptability, Negotiation, Leadership",0.8183
"Leadership, Collaboration, Interpersonal Skills, Effective Communication, Decision Making, Conflict Resolution","Patience, Analytical Thinking, Networking, Decision Making, Coaching, Leadership",0.6549
"Coaching, Mentorship, Emotional Intelligence, Empathy, Creativity","Networking, Active Listening, Adaptability, Effective Communication, Creativity",0.2721
"Active Listening, Mentorship, Stress Management","Confidence, Teamwork, Critical Thinking, Team Collaboration, Coaching",0.4274
"Emotional Intelligence, Work Ethic, Networking, Stress Management, Patience, Adaptability","Leadership, Effective Communication, Adaptability, Team Collaboration, Emotional Intelligence",0.69
"Teamwork, Empathy, Patience, Creativity, Critical Thinking","Empathy, Problem Solving, Time Management",0.3938
"Teamwork, Mentorship, Networking, Creativity","Teamwork, Stress Management, Mentorship, Public Speaking",0.5666
"Empathy, Critical Thinking, Time Management","Analytical Thinking, Patience, Adaptability, Networking",0.6162
"Time Management, Decision Making, Teamwork, Problem Solving","Teamwork, Leadership, Interpersonal Skills, Team Collaboration",0.361
"Work Ethic, Creativity, Leadership, Coaching, Public Speaking","Analytical Thinking, Coaching, Communication, Work Ethic, Stress Management",0.4911
"Networking, Stress Management, Confidence, Coaching, Active Listening, Effective Communication","Critical Thinking, Time Management, Analytical Thinking, Empathy, Team Collaboration, Conflict Resolution",0.0138
"Communication, Conflict Resolution, Work Ethic, Adaptability","Problem Solving, Mentorship, Collaboration, Patience, Interpersonal Skills",0.3463
"Creativity, Effective Communication, Leadership, Mentorship, Coaching, Stress Management","Empathy, Effective Communication, Interpersonal Skills",0.4621
"Patience, Coaching, Time Management, Empathy, Interpersonal Skills","Critical Thinking, Teamwork, Conflict Resolution, Mentorship, Public Speaking, Active Listening",0.3128
"Leadership, Mentorship, Critical Thinking, Adaptability","Coaching, Stress Management, Interpersonal Skills",0.7449
"Interpersonal Skills, Team Collaboration, Networking","Effective Communication, Critical Thinking, Time Management, Decision Making, Interpersonal Skills",0.2855
"Adaptability, Empathy, Decision Making, Critical Thinking","Leadership, Creativity, Emotional Intelligence, Active Listening, Critical Thinking",0.434
"Team Collaboration, Problem Solving, Creativity","Emotional Intelligence, Confidence, Coaching, Analytical Thinking, Leadership, Teamwork",0.5196
"Coaching, Team Collaboration, Patience, Empathy, Critical Thinking, Networking","Decision Making, Problem Solving, Conflict Resolution",0.7162
"Effective Communication, Active Listening, Critical Thinking","Team Collaboration, Leadership, Time Management, Creativity, Teamwork, Interpersonal Skills",0.2846
"Critical Thinking, Mentorship, Networking, Teamwork, Leadership","Stress Management, Mentorship, Team Collaboration, Critical Thinking, Adaptability",0.6745
"Analytical Thinking, Teamwork, Leadership","Stress Management, Teamwork, Coaching, Time Management, Empathy, Creativity",0.5015
"Stress Management, Confidence, Effective Communication, Communication","Critical Thinking, Collaboration, Stress Management, Adaptability, Interpersonal Skills, Mentorship",0.3528
"Adaptability, Confidence, Emotional Intelligence, Stress Management, Work Ethic","Decision Making, Conflict Resolution, Critical Thinking, Coaching",0.5693
"Teamwork, Empathy, Collaboration, Negotiation, Effective Communication, Patience","Creativity, Team Collaboration, Collaboration, Time Management, Analytical Thinking",0.5299
"Leadership, Problem Solving, Empathy, Communication, Active Listening","Negotiation, Emotional Intelligence, Team Collaboration, Teamwork, Communication",0.41
"Work Ethic, Public Speaking, Collaboration, Problem Solving","Work Ethic, Time Management, Public Speaking, Negotiation, Teamwork",0.5105
"Active Listening, Analytical Thinking, Time Management","Conflict Resolution, Communication, Leadership, Teamwork",0.4422
"Interpersonal Skills, Networking, Problem Solving","Creativity, Coaching, Work Ethic, Team Collaboration",0.517
"Negotiation, Effective Communication, Leadership","Empathy, Decision Making, Stress Management",0.5993
"Communication, Coaching, Collaboration, Interpersonal Skills, Empathy","Teamwork, Work Ethic, Communication",0.7379
"Negotiation, Leadership, Creativity, Public Speaking","Critical Thinking, Emotional Intelligence, Time Management, Collaboration, Active Listening, Interpersonal Skills",0.3143
"Networking, Patience, Problem Solving, Work Ethic, Collaboration","Empathy, Public Speaking, Negotiation, Team Collaboration, Active Listening",0.82
"Public Speaking, Networking, Empathy, Emotional Intelligence, Conflict Resolution, Team Collaboration","Team Collaboration, Decision Making, Public Speaking, Conflict Resolution",0.2072
"Effective Communication, Coaching, Emotional Intelligence, Collaboration","Emotional Intelligence, Team Collaboration, Critical Thinking, Public Speaking",0.4772
"Leadership, Coaching, Public Speaking","Networking, Empathy, Analytical Thinking, Creativity",0.5882
"Decision Making, Interpersonal Skills, Public Speaking, Stress Management, Problem Solving, Communication","Coaching, Conflict Resolution, Patience, Leadership, Stress Management, Effective Communication",0.5421
"Confidence, Team Collaboration, Decision Making, Emotional Intelligence, Collaboration, Adaptability","Mentorship, Analytical Thinking, Leadership",0.4066
"Team Collaboration, Mentorship, Negotiation, Stress Management","Mentorship, Interpersonal Skills, Stress Management",0.4688
"Analytical Thinking, Negotiation, Conflict Resolution","Work Ethic, Team Collaboration, Collaboration, Active Listening",0.426
"Active Listening, Effective Communication, Mentorship, Confidence","Work Ethic, Empathy, Confidence, Analytical Thinking, Public Speaking, Stress Management",0.4116
"Communication, Critical Thinking, Emotional Intelligence, Decision Making","Networking, Negotiation, Mentorship, Teamwork, Effective Communication",0.6274
"Time Management, Public Speaking, Communication, Teamwork, Interpersonal Skills, Critical Thinking","Public Speaking, Decision Making, Emotional Intelligence, Networking, Critical Thinking, Stress Management",0.5536
"Stress Management, Analytical Thinking, Interpersonal Skills, Collaboration","Stress Management, Work Ethic, Leadership, Decision Making, Communication",0.3961
"Public Speaking, Patience, Interpersonal Skills","Effective Communication, Problem Solving, Team Collaboration, Adaptability, Networking, Confidence",0.6349
"Adaptability, Analytical Thinking, Critical Thinking, Negotiation, Public Speaking","Confidence, Conflict Resolution, Creativity, Interpersonal Skills, Leadership",0.5461
"Effective Communication, Emotional Intelligence, Time Management, Empathy, Team Collaboration, Teamwork","Stress Management, Time Management, Collaboration, Teamwork, Problem Solving, Analytical Thinking",0.6219
"Collaboration, Emotional Intelligence, Active Listening, Problem Solving, Coaching","Communication, Patience, Time Management, Stress Management, Public Speaking",0.5944
"Stress Management, Critical Thinking, Negotiation, Analytical Thinking","Work Ethic, Adaptability, Emotional Intelligence, Communication, Confidence",0.3757
"Active Listening, Public Speaking, Confidence, Leadership, Adaptability, Communication","Networking, Analytical Thinking, Effective Communication, Creativity",0.416
"Leadership, Patience, Interpersonal Skills, Teamwork, Work Ethic, Stress Management","Problem Solving, Conflict Resolution, Empathy, Negotiation, Collaboration, Confidence",0.6121
"Public Speaking, Communication, Team Collaboration, Emotional Intelligence, Negotiation","Critical Thinking, Effective Communication, Mentorship, Communication, Problem Solving",0.5916
"Communication, Emotional Intelligence, Critical Thinking","Interpersonal Skills, Team Collaboration, Confidence, Effective Communication",0.4969
"Conflict Resolution, Team Collaboration, Effective Communication, Communication, Leadership","Networking, Conflict Resolution, Public Speaking",0.5176
"Collaboration, Creativity, Emotional Intelligence, Empathy, Effective Communication","Emotional Intelligence, Coaching, Active Listening",0.6916
"Work Ethic, Analytical Thinking, Emotional Intelligence, Negotiation","Analytical Thinking, Teamwork, Conflict Resolution, Time Management",0.4113
"Patience, Critical Thinking, Public Speaking, Work Ethic, Problem Solving","Networking, Collaboration, Coaching, Effective Communication, Communication",0.5821
"Team Collaboration, Stress Management, Patience","Mentorship, Creativity, Effective Communication, Decision Making, Collaboration",0.4697
"Conflict Resolution, Leadership, Creativity, Critical Thinking, Active Listening","Active Listening, Public Speaking, Teamwork, Leadership",0.4673
"Creativity, Problem Solving, Networking","Patience, Time Management, Communication, Negotiation, Interpersonal Skills, Stress Management",0.6648
"Communication, Interpersonal Skills, Leadership","Team Collaboration, Adaptability, Time Management, Emotional Intelligence, Leadership",0.6238
"Stress Management, Emotional Intelligence, Public Speaking, Coaching","Teamwork, Networking, Stress Management, Negotiation, Public Speaking, Time Management",0.622
"Effective Communication, Coaching, Interpersonal Skills, Decision Making","Patience, Teamwork, Work Ethic",0.6958
"Patience, Empathy, Negotiation, Adaptability, Problem Solving","Communication, Time Management, Decision Making, Stress Management, Collaboration, Confidence",0.5032
"Public Speaking, Confidence, Stress Management","Patience, Communication, Active Listening",0.6023
"Team Collaboration, Stress Management, Active Listening, Interpersonal Skills, Teamwork","Emotional Intelligence, Analytical Thinking, Coaching, Conflict Resolution, Mentorship",0.4535
"Critical Thinking, Analytical Thinking, Public Speaking, Conflict Resolution, Collaboration, Creativity","Teamwork, Patience, Active Listening, Collaboration, Decision Making",0.5486
"Work Ethic, Critical Thinking, Adaptability, Analytical Thinking","Adaptability, Decision Making, Critical Thinking",0.4805
"Active Listening, Stress Management, Effective Communication, Emotional Intelligence, Adaptability","Mentorship, Stress Management, Creativity, Empathy, Confidence, Patience",0.5145
"Analytical Thinking, Empathy, Confidence, Active Listening, Time Management","Confidence, Effective Communication, Decision Making, Empathy, Emotional Intelligence, Active Listening",0.5893
"Emotional Intelligence, Coaching, Work Ethic, Problem Solving, Adaptability","Conflict Resolution, Communication, Leadership, Public Speaking, Stress Management, Decision Making",0.3773
"Confidence, Communication, Empathy, Negotiation","Critical Thinking, Problem Solving, Leadership, Active Listening, Coaching, Collaboration",0.8139
"Critical Thinking, Active Listening, Work Ethic, Confidence, Emotional Intelligence","Stress Management, Conflict Resolution, Negotiation, Effective Communication",0.3491
"Interpersonal Skills, Networking, Creativity, Leadership","Adaptability, Creativity, Active Listening, Leadership, Critical Thinking",0.3179
"Work Ethic, Networking, Stress Management, Negotiation","Adaptability, Mentorship, Active Listening, Leadership",0.6737
"Adaptability, Team Collaboration, Effective Communication, Critical Thinking, Teamwork, Collaboration","Problem Solving, Patience, Confidence",0.6187
"Work Ethic, Emotional Intelligence, Empathy","Empathy, Conflict Resolution, Teamwork, Adaptability",0.5936
"Networking, Coaching, Emotional Intelligence","Public Speaking, Work Ethic, Mentorship",0.5943
"Decision Making, Emotional Intelligence, Time Management","Analytical Thinking, Empathy, Communication",0.4982
"Emotional Intelligence, Collaboration, Empathy","Decision Making, Time Management, Leadership, Empathy, Problem Solving, Creativity",0.3654
"Conflict Resolution, Creativity, Collaboration, Decision Making, Time Management, Teamwork","Interpersonal Skills, Mentorship, Communication, Active Listening, Conflict Resolution, Work Ethic",0.5114
"Negotiation, Problem Solving, Creativity, Patience, Networking","Interpersonal Skills, Creativity, Work Ethic",0.3984
"Networking, Stress Management, Critical Thinking, Leadership","Team Collaboration, Public Speaking, Patience, Interpersonal Skills, Work Ethic, Adaptability",0.6463
"Mentorship, Coaching, Leadership","Mentorship, Stress Management, Coaching, Emotional Intelligence, Negotiation",0.4779
"Active Listening, Public Speaking, Problem Solving, Mentorship","Team Collaboration, Interpersonal Skills, Adaptability, Active Listening",0.3762
"Work Ethic, Adaptability, Coaching, Communication","Problem Solving, Confidence, Analytical Thinking, Public Speaking, Mentorship, Team Collaboration",0.4518
"Confidence, Communication, Coaching, Stress Management, Team Collaboration, Interpersonal Skills","Stress Management, Creativity, Effective Communication",0.5619
"Team Collaboration, Public Speaking, Analytical Thinking","Teamwork, Active Listening, Mentorship, Adaptability, Public Speaking, Confidence",0.4154
"Decision Making, Leadership, Work Ethic, Coaching, Networking","Communication, Networking, Time Management, Analytical Thinking, Public Speaking",0.3767
"Collaboration, Coaching, Communication","Decision Making, Problem Solving, Teamwork",0.5366
