ResumeSkill,JobSkill,TentativeScore
"Work Ethic, Stress Management, Empathy, Communication, Patience, Active Listening","Public Speaking, Active Listening, Adaptability",0.5745
"Mentorship, Critical Thinking, Teamwork, Confidence, Conflict Resolution, Interpersonal Skills","Creativity, Patience, Communication, Public Speaking, Time Management",0.4793
"Active Listening, Creativity, Team Collaboration, Mentorship","Mentorship, Communication, Conflict Resolution, Problem Solving, Confidence",0.5972
"Public Speaking, Creativity, Adaptability, Analytical Thinking","Creativity, Negotiation, Leadership, Patience, Adaptability, Coaching",0.7285
"Work Ethic, Active Listening, Critical Thinking, Interpersonal Skills","Active Listening, Adaptability, Mentorship, Effective Communication",0.4649
"Work Ethic, Time Management, Effective Communication, Communication","Analytical Thinking, Coaching, Patience, Networking",0.4649
"Team Collaboration, Negotiation, Coaching, Communication, Networking","Problem Solving, Collaboration, Interpersonal Skills, Time Management",0.7369
"Emotional Intelligence, Conflict Resolution, Time Management, Problem Solving","Critical Thinking, Emotional Intelligence, Mentorship, Team Collaboration, Communication, Coaching",0.6151
"Networking, Teamwork, Effective Communication, Leadership","Problem Solving, Mentorship, Active Listening",0.4296
"Time Management, Empathy, Team Collaboration, Decision Making, Effective Communication, Collaboration","Empathy, Teamwork, Emotional Intelligence, Public Speaking, Negotiation",0.5814
"Analytical Thinking, Emotional Intelligence, Time Management, Creativity, Negotiation","Coaching, Empathy, Analytical Thinking, Public Speaking, Confidence, Negotiation",0.4305
"Patience, Work Ethic, Problem Solving, Creativity, Empathy","Stress Management, Adaptability, Analytical Thinking, Networking",0.4301
"Time Management, Stress Management, Networking","Creativity, Critical Thinking, Communication, Leadership, Effective Communication, Active Listening",0.5363
"Patience, Emotional Intelligence, Empathy, Stress Management","Public Speaking, Mentorship, Work Ethic, Emotional Intelligence, Collaboration",0.213
"Creativity, Coaching, Critical Thinking, Collaboration","Teamwork, Interpersonal Skills, Coaching",0.2413
"Networking, Effective Communication, Creativity, Emotional Intelligence, Active Listening, Work Ethic","Confidence, Problem Solving, Negotiation, Interpersonal Skills",0.4157
"Emotional Intelligence, Active Listening, Time Management, Stress Management, Critical Thinking, Conflict Resolution","Time Management, Critical Thinking, Decision Making",0.3481
"Problem Solving, Adaptability, Decision Making, Effective Communication","Confidence, Communication, Team Collaboration, Patience",0.5471
"Collaboration, Teamwork, Confidence, Problem Solving, Networking, Mentorship","Creativity, Public Speaking, Collaboration, Coaching, Critical Thinking, Mentorship",0.3638
"Work Ethic, Networking, Adaptability, Analytical Thinking, Interpersonal Skills","Active Listening, Effective Communication, Communication, Networking, Mentorship",0.2882
"Team Collaboration, Coaching, Empathy, Emotional Intelligence, Public Speaking","Problem Solving, Emotional Intelligence, Conflict Resolution",0.7198
"Teamwork, Stress Management, Networking, Negotiation, Public Speaking, Conflict Resolution","Conflict Resolution, Active Listening, Emotional Intelligence, Work Ethic, Collaboration, Teamwork",0.4661
"Emotional Intelligence, Active Listening, Adaptability","Analytical Thinking, Networking, Stress Management, Creativity, Work Ethic",0.5101
"Problem Solving, Work Ethic, Mentorship","Communication, Patience, Critical Thinking, Interpersonal Skills",0.2863
"Adaptability, Work Ethic, Interpersonal Skills, Time Management, Analytical Thinking","Work Ethic, Analytical Thinking, Active Listening, Effective Communication",0.4183
"Creativity, Effective Communication, Coaching, Team Collaboration","Critical Thinking, Negotiation, Analytical Thinking, Collaboration",0.5166
"Work Ethic, Decision Making, Effective Communication, Patience","Coaching, Critical Thinking, Confidence",0.3274
"Interpersonal Skills, Negotiation, Adaptability, Time Management, Coaching","Negotiation, Empathy, Analytical Thinking, Stress Management, Patience, Active Listening",0.5564
"Emotional Intelligence, Work Ethic, Confidence","Analytical Thinking, Decision Making, Interpersonal Skills, Conflict Resolution",0.4099
"Confidence, Creativity, Stress Management","Effective Communication, Team Collaboration, Critical Thinking, Mentorship",0.4562
"Decision Making, Empathy, Teamwork, Conflict Resolution, Leadership, Time Management","Critical Thinking, Mentorship, Adaptability, Emotional Intelligence, Coaching, Patience",0.4097
"Patience, Analytical Thinking, Team Collaboration, Conflict Resolution, Emotional Intelligence","Creativity, Public Speaking, Negotiation, Stress Management",0.7778
"Critical Thinking, Creativity, Public Speaking, Conflict Resolution, Teamwork, Analytical Thinking","Conflict Resolution, Work Ethic, Interpersonal Skills, Emotional Intelligence, Decision Making, Creativity",0.498
"Active Listening, Collaboration, Conflict Resolution, Negotiation, Leadership, Analytical Thinking","Public Speaking, Mentorship, Active Listening, Problem Solving",0.3413
"Coaching, Teamwork, Collaboration, Time Management, Effective Communication","Active Listening, Confidence, Critical Thinking, Effective Communication",0.6234
"Interpersonal Skills, Patience, Negotiation","Networking, Emotional Intelligence, Stress Management, Mentorship, Team Collaboration, Teamwork",0.3169
"Coaching, Communication, Analytical Thinking, Mentorship, Empathy","Effective Communication, Emotional Intelligence, Patience",0.5313
"Coaching, Confidence, Team Collaboration, Problem Solving, Active Listening","Creativity, Coaching, Effective Communication",0.206
"Confidence, Emotional Intelligence, Team Collaboration, Conflict Resolution, Networking, Communication","Teamwork, Critical Thinking, Networking, Patience, Confidence",0.3008
"Coaching, Confidence, Patience","Conflict Resolution, Public Speaking, Patience, Interpersonal Skills, Communication",0.5295
"Coaching, Communication, Analytical Thinking, Public Speaking, Adaptability","Analytical Thinking, Adaptability, Stress Management, Collaboration",0.6108
"Team Collaboration, Creativity, Confidence, Coaching, Teamwork, Public Speaking","Work Ethic, Team Collaboration, Public Speaking, Networking",0.5257
"Empathy, Emotional Intelligence, Problem Solving","Collaboration, Leadership, Teamwork, Effective Communication, Active Listening",0.4827
"Emotional Intelligence, Time Management, Effective Communication, Active Listening","Mentorship, Collaboration, Teamwork, Problem Solving, Empathy, Time Management",0.4548
"Negotiation, Teamwork, Communication, Networking, Interpersonal Skills","Conflict Resolution, Patience, Decision Making, Stress Management, Team Collaboration, Analytical Thinking",0.2782
"Empathy, Work Ethic, Coaching, Stress Management, Time Management, Creativity","Teamwork, Communication, Decision Making",0.392
"Emotional Intelligence, Teamwork, Collaboration, Effective Communication","Team Collaboration, Leadership, Teamwork, Analytical Thinking, Emotional Intelligence, Confidence",0.4309
"Communication, Emotional Intelligence, Time Management, Decision Making, Leadership, Effective Communication","Adaptability, Analytical Thinking, Networking, Confidence",0.6586
"Collaboration, Problem Solving, Teamwork, Confidence, Active Listening, Team Collaboration","Confidence, Public Speaking, Effective Communication, Patience",0.5515
"Creativity, Communication, Effective Communication, Analytical Thinking","Conflict Resolution, Communication, Collaboration",0.2355
"Effective Communication, Adaptability, Stress Management","Critical Thinking, Conflict Resolution, Creativity, Stress Management",0.5486
"Mentorship, Work Ethic, Effective Communication, Stress Management, Confidence, Teamwork","Empathy, Emotional Intelligence, Leadership, Teamwork",0.4422
"Public Speaking, Creativity, Team Collaboration, Active Listening, Time Management, Communication","Communication, Public Speaking, Emotional Intelligence",0.3985
"Leadership, Interpersonal Skills, Negotiation","Empathy, Team Collaboration, Communication, Leadership, Teamwork, Conflict Resolution",0.5918
"Networking, Leadership, Mentorship, Adaptability, Coaching, Collaboration","Time Management, Empathy, Networking, Collaboration, Analytical Thinking, Negotiation",0.6546
"Interpersonal Skills, Negotiation, Work Ethic, Networking","Active Listening, Networking, Coaching, Interpersonal Skills",0.6397
"Public Speaking, Confidence, Emotional Intelligence, Mentorship, Effective Communication","Problem Solving, Leadership, Work Ethic, Interpersonal Skills, Effective Communication",0.3741
"Critical Thinking, Networking, Negotiation, Mentorship, Coaching","Analytical Thinking, Public Speaking, Stress Management, Work Ethic",0.4536
"Adaptability, Problem Solving, Active Listening","Conflict Resolution, Stress Management, Negotiation, Team Collaboration, Emotional Intelligence",0.5497
"Creativity, Conflict Resolution, Public Speaking","Interpersonal Skills, Stress Management, Decision Making",0.6463
"Collaboration, Confidence, Stress Management, Communication","Emotional Intelligence, Empathy, Patience, Networking",0.4281
"Active Listening, Patience, Emotional Intelligence","Decision Making, Team Collaboration, Problem Solving",0.4722
"Adaptability, Critical Thinking, Public Speaking, Coaching","Confidence, Creativity, Active Listening, Work Ethic, Mentorship",0.334
"Negotiation, Conflict Resolution, Creativity","Stress Management, Conflict Resolution, Public Speaking, Analytical Thinking",0.3206
"Analytical Thinking, Decision Making, Mentorship, Adaptability, Leadership","Time Management, Team Collaboration, Interpersonal Skills, Coaching, Leadership",0.6219
"Effective Communication, Problem Solving, Coaching, Decision Making","Adaptability, Effective Communication, Confidence, Time Management, Networking, Decision Making",0.7034
"Confidence, Work Ethic, Problem Solving","Effective Communication, Team Collaboration, Interpersonal Skills, Confidence, Collaboration, Problem Solving",0.4892
"Team Collaboration, Negotiation, Conflict Resolution, Interpersonal Skills, Leadership","Creativity, Teamwork, Empathy, Public Speaking, Analytical Thinking, Decision Making",0.6505
"Decision Making, Collaboration, Conflict Resolution","Collaboration, Coaching, Negotiation, Teamwork, Communication, Critical Thinking",0.5542
"Teamwork, Networking, Analytical Thinking, Collaboration","Active Listening, Analytical Thinking, Collaboration",0.4032
"Analytical Thinking, Team Collaboration, Creativity","Mentorship, Adaptability, Decision Making, Teamwork, Negotiation, Confidence",0.5542
"Problem Solving, Public Speaking, Mentorship, Time Management","Empathy, Active Listening, Collaboration, Conflict Resolution",0.7307
"Time Management, Patience, Creativity","Critical Thinking, Communication, Confidence, Conflict Resolution, Public Speaking, Negotiation",0.4946
"Work Ethic, Time Management, Conflict Resolution","Problem Solving, Time Management, Interpersonal Skills, Analytical Thinking, Conflict Resolution",0.7347
"Coaching, Active Listening, Critical Thinking, Team Collaboration, Stress Management","Conflict Resolution, Collaboration, Communication, Critical Thinking, Decision Making, Patience",0.107
"Problem Solving, Communication, Mentorship, Negotiation, Public Speaking","Critical Thinking, Creativity, Coaching, Active Listening, Leadership, Interpersonal Skills",0.6233
"Public Speaking, Decision Making, Networking, Interpersonal Skills, Active Listening","Conflict Resolution, Work Ethic, Public Speaking, Teamwork",0.5131
"Leadership, Analytical Thinking, Stress Management, Patience","Problem Solving, Confidence, Public Speaking, Team Collaboration, Networking, Empathy",0.4551
"Team Collaboration, Communication, Negotiation","Critical Thinking, Interpersonal Skills, Stress Management",0.5138
"Networking, Stress Management, Confidence","Creativity, Active Listening, Interpersonal Skills, Emotional Intelligence, Team Collaboration",0.2019
"Conflict Resolution, Emotional Intelligence, Collaboration","Stress Management, Decision Making, Team Collaboration, Patience, Public Speaking, Active Listening",0.467
"Problem Solving, Communication, Empathy, Creativity, Team Collaboration","Confidence, Negotiation, Analytical Thinking",0.5536
"Coaching, Time Management, Networking","Leadership, Networking, Analytical Thinking, Empathy, Adaptability",0.7217
"Empathy, Mentorship, Coaching, Stress Management, Decision Making, Analytical Thinking","Active Listening, Networking, Work Ethic",0.4223
"Negotiation, Mentorship, Conflict Resolution, Stress Management, Communication, Empathy","Analytical Thinking, Creativity, Teamwork, Critical Thinking, Time Management",0.3787
"Mentorship, Problem Solving, Creativity","Coaching, Team Collaboration, Work Ethic, Interpersonal Skills",0.4247
"Confidence, Effective Communication, Work Ethic, Leadership, Adaptability, Networking","Collaboration, Decision Making, Active Listening, Interpersonal Skills, Conflict Resolution, Creativity",0.6373
"Problem Solving, Interpersonal Skills, Team Collaboration, Coaching, Communication","Time Management, Coaching, Stress Management, Active Listening, Problem Solving",0.5493
"Creativity, Empathy, Patience","Analytical Thinking, Adaptability, Problem Solving, Negotiation",0.4205
"Networking, Public Speaking, Active Listening, Work Ethic","Conflict Resolution, Negotiation, Teamwork, Mentorship",0.577
"Creativity, Conflict Resolution, Patience, Analytical Thinking, Mentorship, Empathy","Problem Solving, Work Ethic, Active Listening, Stress Management, Empathy",0.5146
"Negotiation, Confidence, Emotional Intelligence, Mentorship, Empathy","Conflict Resolution, Leadership, Time Management, Effective Communication, Decision Making, Analytical Thinking",0.6453
"Leadership, Conflict Resolution, Team Collaboration, Confidence, Creativity","Conflict Resolution, Time Management, Coaching, Negotiation, Team Collaboration",0.3947
"Creativity, Negotiation, Patience, Networking, Leadership","Problem Solving, Collaboration, Creativity, Confidence",0.4509
"Analytical Thinking, Teamwork, Negotiation, Adaptability","Coaching, Confidence, Stress Management, Collaboration, Emotional Intelligence",0.4412
"Communication, Decision Making, Stress Management","Confidence, Time Management, Stress Management, Work Ethic, Public Speaking",0.2805
"Team Collaboration, Adaptability, Work Ethic, Teamwork, Mentorship","Teamwork, Networking, Problem Solving, Interpersonal Skills, Stress Management, Patience",0.5444
"Coaching, Stress Management, Teamwork, Leadership","Active Listening, Collaboration, Team Collaboration, Leadership, Empathy, Work Ethic",0.5392
"Stress Management, Active Listening, Problem Solving","Emotional Intelligence, Creativity, Work Ethic",0.5008
"Decision Making, Problem Solving, Interpersonal Skills","Problem Solving, Team Collaboration, Time Management, Active Listening, Critical Thinking",0.4648
"Critical Thinking, Problem Solving, Networking","Negotiation, Conflict Resolution, Critical Thinking, Confidence, Collaboration",0.2877
"Empathy, Critical Thinking, Decision Making","Conflict Resolution, Critical Thinking, Creativity, Negotiation, Empathy",0.4369
"Emotional Intelligence, Confidence, Team Collaboration, Analytical Thinking, Mentorship, Decision Making","Teamwork, Problem Solving, Coaching, Analytical Thinking",0.4486
"Collaboration, Conflict Resolution, Coaching","Empathy, Communication, Negotiation, Networking",0.3797
"Leadership, Work Ethic, Analytical Thinking, Patience, Confidence","Communication, Emotional Intelligence, Creativity, Teamwork, Empathy",0.4758
"Negotiation, Stress Management, Adaptability, Decision Making, Coaching","Negotiation, Collaboration, Interpersonal Skills, Communication",0.5606
"Teamwork, Emotional Intelligence, Problem Solving, Confidence","Confidence, Networking, Leadership, Time Management, Active Listening, Communication",0.7829
"Coaching, Communication, Work Ethic, Leadership, Emotional Intelligence","Team Collaboration, Empathy, Effective Communication",0.5262
"Effective Communication, Adaptability, Critical Thinking, Active Listening","Leadership, Emotional Intelligence, Teamwork, Creativity, Stress Management",0.5386
"Coaching, Adaptability, Empathy, Teamwork, Critical Thinking, Problem Solving","Teamwork, Stress Management, Analytical Thinking, Public Speaking, Team Collaboration",0.4888
"Negotiation, Critical Thinking, Teamwork, Leadership","Analytical Thinking, Problem Solving, Teamwork, Critical Thinking",0.2122
"Decision Making, Patience, Empathy","Work Ethic, Mentorship, Decision Making, Patience, Leadership, Teamwork",0.496
"Active Listening, Mentorship, Work Ethic, Leadership, Empathy","Emotional Intelligence, Leadership, Networking, Negotiation",0.509
"Teamwork, Work Ethic, Collaboration, Stress Management, Time Management, Public Speaking","Negotiation, Networking, Decision Making, Leadership, Analytical Thinking, Stress Management",0.8695
"Active Listening, Leadership, Public Speaking","Teamwork, Team Collaboration, Conflict Resolution",0.4711
"Analytical Thinking, Leadership, Emotional Intelligence","Stress Management, Team Collaboration, Effective Communication, Emotional Intelligence",0.5452
"Empathy, Critical Thinking, Effective Communication, Communication, Stress Management","Critical Thinking, Coaching, Active Listening, Work Ethic, Empathy, Adaptability",0.4948
"Leadership, Communication, Creativity, Effective Communication, Negotiation","Teamwork, Active Listening, Collaboration, Conflict Resolution",0.3247
"Public Speaking, Decision Making, Adaptability","Negotiation, Teamwork, Public Speaking",0.6714
"Networking, Work Ethic, Coaching, Public Speaking","Problem Solving, Active Listening, Leadership, Teamwork, Critical Thinking, Analytical Thinking",0.6128
"Leadership, Creativity, Effective Communication, Empathy","Time Management, Networking, Public Speaking, Teamwork, Team Collaboration",0.6187
"Empathy, Critical Thinking, Patience, Team Collaboration, Active Listening, Communication","Work Ethic, Interpersonal Skills, Leadership, Active Listening, Emotional Intelligence, Conflict Resolution",0.3636
"Conflict Resolution, Analytical Thinking, Time Management, Decision Making, Leadership, Collaboration","Adaptability, Decision Making, Problem Solving, Public Speaking, Critical Thinking",0.7104
"Creativity, Interpersonal Skills, Public Speaking, Critical Thinking","Stress Management, Mentorship, Teamwork, Networking, Adaptability",0.2897
"Stress Management, Effective Communication, Confidence","Empathy, Interpersonal Skills, Effective Communication, Coaching, Work Ethic",0.588
"Leadership, Stress Management, Negotiation, Team Collaboration, Confidence, Active Listening","Creativity, Patience, Collaboration",0.8286
"Public Speaking, Leadership, Networking, Negotiation, Creativity, Communication","Mentorship, Analytical Thinking, Empathy, Work Ethic, Emotional Intelligence",0.3514
"Analytical Thinking, Conflict Resolution, Patience, Effective Communication, Networking","Problem Solving, Team Collaboration, Empathy, Collaboration, Conflict Resolution, Time Management",0.4151
"Conflict Resolution, Coaching, Effective Communication","Teamwork, Analytical Thinking, Decision Making, Leadership, Empathy, Conflict Resolution",0.5149
"Critical Thinking, Confidence, Team Collaboration, Collaboration","Time Management, Interpersonal Skills, Teamwork, Work Ethic",0.4245
"Creativity, Time Management, Active Listening, Interpersonal Skills, Critical Thinking","Decision Making, Confidence, Networking, Interpersonal Skills",0.2674
"Interpersonal Skills, Stress Management, Empathy, Public Speaking, Problem Solving","Communication, Conflict Resolution, Time Management, Problem Solving, Empathy",0.5103
"Adaptability, Critical Thinking, Mentorship, Coaching, Active Listening","Analytical Thinking, Active Listening, Stress Management, Adaptability, Leadership, Coaching",0.3407
"Team Collaboration, Emotional Intelligence, Problem Solving","Networking, Problem Solving, Analytical Thinking",0.571
"Confidence, Patience, Critical Thinking, Public Speaking","Networking, Adaptability, Effective Communication, Stress Management",0.3621
"Teamwork, Problem Solving, Negotiation, Collaboration, Team Collaboration, Mentorship","Interpersonal Skills, Effective Communication, Collaboration, Mentorship, Public Speaking, Decision Making",0.7325
"Team Collaboration, Mentorship, Problem Solving, Coaching, Patience","Patience, Work Ethic, Negotiation, Collaboration",0.3825
"Empathy, Emotional Intelligence, Work Ethic","Empathy, Analytical Thinking, Collaboration, Decision Making",0.4517
"Networking, Critical Thinking, Emotional Intelligence","Empathy, Time Management, Problem Solving, Networking",0.622
"Mentorship, Stress Management, Public Speaking, Time Management, Decision Making","Time Management, Patience, Interpersonal Skills, Confidence, Effective Communication, Adaptability",0.3154
"Negotiation, Mentorship, Interpersonal Skills","Adaptability, Decision Making, Critical Thinking, Communication, Active Listening, Empathy",0.5341
"Negotiation, Leadership, Problem Solving","Leadership, Analytical Thinking, Empathy, Adaptability, Work Ethic",0.6961
"Creativity, Coaching, Critical Thinking","Collaboration, Public Speaking, Confidence, Critical Thinking",0.2589
"Collaboration, Adaptability, Conflict Resolution, Coaching, Stress Management, Active Listening","Problem Solving, Networking, Empathy, Mentorship, Time Management",0.5277
"Mentorship, Teamwork, Emotional Intelligence","Decision Making, Adaptability, Patience",0.539
"Mentorship, Emotional Intelligence, Critical Thinking, Decision Making","Emotional Intelligence, Confidence, Empathy, Creativity",0.6173
"Active Listening, Coaching, Effective Communication","Negotiation, Stress Management, Collaboration, Time Management, Active Listening, Patience",0.3145
"Team Collaboration, Networking, Problem Solving, Analytical Thinking, Patience","Decision Making, Networking, Communication, Analytical Thinking",0.3019
"Mentorship, Communication, Team Collaboration, Stress Management","Public Speaking, Networking, Coaching, Problem Solving, Work Ethic",0.5783
"Decision Making, Stress Management, Active Listening, Confidence","Time Management, Conflict Resolution, Networking, Team Collaboration, Leadership, Interpersonal Skills",0.5445
"Leadership, Interpersonal Skills, Active Listening, Networking, Coaching","Stress Management, Decision Making, Public Speaking, Problem Solving",0.5376
"Conflict Resolution, Time Management, Work Ethic","Coaching, Mentorship, Critical Thinking, Decision Making, Effective Communication",0.552
"Teamwork, Time Management, Public Speaking","Problem Solving, Patience, Work Ethic, Networking, Teamwork, Interpersonal Skills",0.398
"Active Listening, Leadership, Problem Solving, Negotiation, Collaboration","Emotional Intelligence, Leadership, Coaching, Critical Thinking, Decision Making, Confidence",0.5348
"Teamwork, Networking, Effective Communication, Adaptability","Confidence, Communication, Team Collaboration",0.544
"Stress Management, Mentorship, Problem Solving, Patience, Collaboration, Teamwork","Time Management, Work Ethic, Creativity, Patience, Collaboration, Negotiation",0.3928
"Networking, Analytical Thinking, Patience","Coaching, Adaptability, Analytical Thinking, Time Management, Mentorship",0.7799
"Problem Solving, Team Collaboration, Empathy, Collaboration","Effective Communication, Problem Solving, Teamwork, Communication",0.5711
"Confidence, Critical Thinking, Conflict Resolution, Interpersonal Skills, Communication, Emotional Intelligence","Collaboration, Communication, Decision Making, Leadership",0.3213
"Coaching, Networking, Teamwork, Stress Management","Empathy, Creativity, Teamwork, Leadership, Emotional Intelligence, Team Collaboration",0.5985
"Critical Thinking, Team Collaboration, Interpersonal Skills, Analytical Thinking, Empathy","Active Listening, Adaptability, Work Ethic, Communication",0.3538
"Decision Making, Creativity, Communication, Negotiation, Empathy, Networking","Effective Communication, Public Speaking, Creativity, Coaching, Leadership, Mentorship",0.6181
"Adaptability, Emotional Intelligence, Teamwork, Communication, Stress Management","Team Collaboration, Empathy, Collaboration, Emotional Intelligence",0.6738
"Problem Solving, Effective Communication, Emotional Intelligence, Active Listening, Work Ethic, Collaboration","Confidence, Work Ethic, Public Speaking, Negotiation, Problem Solving, Active Listening",0.3769
"Empathy, Critical Thinking, Communication, Emotional Intelligence","Critical Thinking, Creativity, Teamwork",0.6445
"Teamwork, Critical Thinking, Networking, Stress Management, Public Speaking, Confidence","Adaptability, Team Collaboration, Interpersonal Skills",0.5619
"Leadership, Effective Communication, Confidence, Collaboration","Creativity, Team Collaboration, Public Speaking",0.6233
"Creativity, Problem Solving, Teamwork, Leadership, Analytical Thinking, Conflict Resolution","Interpersonal Skills, Decision Making, Coaching, Problem Solving, Creativity, Adaptability",0.7845
"Networking, Team Collaboration, Emotional Intelligence, Interpersonal Skills","Confidence, Networking, Collaboration, Problem Solving",0.4632
"Empathy, Mentorship, Patience","Emotional Intelligence, Empathy, Leadership, Problem Solving, Team Collaboration",0.3869
"Teamwork, Stress Management, Adaptability, Time Management, Effective Communication","Analytical Thinking, Problem Solving, Collaboration, Teamwork, Public Speaking",0.3666
