ResumeSkill,JobSkill,TentativeScore
"Interpersonal Skills, Leadership, Communication","Stress Management, Problem Solving, Work Ethic, Negotiation, Time Management, Teamwork",0.5367
"Communication, Confidence, Stress Management","Team Collaboration, Emotional Intelligence, Confidence, Decision Making",0.424
"Emotional Intelligence, Work Ethic, Leadership, Team Collaboration","Decision Making, Coaching, Work Ethic",0.4293
"Creativity, Emotional Intelligence, Decision Making, Collaboration, Empathy","Team Collaboration, Active Listening, Problem Solving",0.5348
"Coaching, Time Management, Patience, Decision Making, Conflict Resolution, Communication","Communication, Decision Making, Collaboration, Teamwork, Networking",0.2828
"Patience, Effective Communication, Stress Management, Empathy","Collaboration, Analytical Thinking, Critical Thinking, Communication, Teamwork",0.2889
"Team Collaboration, Confidence, Interpersonal Skills","Time Management, Public Speaking, Teamwork, Effective Communication, Networking, Team Collaboration",0.3922
"Empathy, Negotiation, Team Collaboration, Critical Thinking","Conflict Resolution, Empathy, Work Ethic, Negotiation, Time Management",0.468
"Conflict Resolution, Critical Thinking, Confidence, Stress Management, Leadership","Confidence, Public Speaking, Decision Making, Stress Management, Time Management",0.5466
"Stress Management, Critical Thinking, Problem Solving, Teamwork, Coaching","Work Ethic, Public Speaking, Communication, Coaching, Empathy",0.7213
"Communication, Active Listening, Conflict Resolution, Creativity, Collaboration","Public Speaking, Confidence, Collaboration, Coaching, Critical Thinking, Problem Solving",0.6286
"Adaptability, Emotional Intelligence, Collaboration, Stress Management, Team Collaboration","Emotional Intelligence, Negotiation, Time Management, Creativity",0.476
"Problem Solving, Mentorship, Work Ethic, Effective Communication, Conflict Resolution, Emotional Intelligence","Collaboration, Active Listening, Interpersonal Skills",0.4971
"Mentorship, Time Management, Public Speaking, Coaching","Work Ethic, Patience, Collaboration, Negotiation, Problem Solving",0.3496
"Confidence, Conflict Resolution, Critical Thinking, Active Listening","Critical Thinking, Team Collaboration, Creativity, Collaboration, Networking",0.4972
"Confidence, Analytical Thinking, Mentorship, Adaptability, Networking, Effective Communication","Coaching, Mentorship, Leadership, Adaptability, Creativity",0.4567
"Effective Communication, Problem Solving, Empathy","Interpersonal Skills, Coaching, Team Collaboration, Conflict Resolution, Communication",0.5484
"Interpersonal Skills, Conflict Resolution, Critical Thinking, Leadership","Networking, Patience, Mentorship, Work Ethic, Public Speaking",0.3759
"Networking, Interpersonal Skills, Active Listening, Empathy, Leadership, Teamwork","Team Collaboration, Problem Solving, Teamwork, Critical Thinking",0.5779
"Active Listening, Collaboration, Teamwork, Analytical Thinking, Work Ethic","Networking, Active Listening, Time Management",0.7299
"Creativity, Empathy, Networking, Confidence, Active Listening, Teamwork","Emotional Intelligence, Critical Thinking, Work Ethic, Active Listening, Effective Communication",0.4837
"Analytical Thinking, Emotional Intelligence, Collaboration, Decision Making, Interpersonal Skills, Confidence","Networking, Communication, Critical Thinking, Active Listening, Patience",0.5603
"Analytical Thinking, Teamwork, Conflict Resolution","Analytical Thinking, Creativity, Conflict Resolution, Leadership, Team Collaboration",0.6035
"Conflict Resolution, Analytical Thinking, Coaching, Effective Communication, Public Speaking","Leadership, Emotional Intelligence, Conflict Resolution",0.4398
"Adaptability, Confidence, Analytical Thinking, Patience","Active Listening, Confidence, Decision Making, Collaboration, Creativity, Interpersonal Skills",0.5336
"Collaboration, Public Speaking, Work Ethic, Team Collaboration","Confidence, Public Speaking, Work Ethic, Mentorship, Collaboration",0.5019
"Leadership, Empathy, Coaching, Analytical Thinking, Conflict Resolution, Creativity","Coaching, Analytical Thinking, Time Management",0.5147
"Effective Communication, Public Speaking, Adaptability, Communication, Emotional Intelligence","Coaching, Problem Solving, Adaptability, Empathy, Confidence",0.384
"Effective Communication, Stress Management, Mentorship","Coaching, Negotiation, Emotional Intelligence",0.5037
"Problem Solving, Time Management, Communication, Mentorship","Creativity, Negotiation, Coaching",0.5747
"Networking, Collaboration, Public Speaking, Negotiation, Coaching","Critical Thinking, Conflict Resolution, Problem Solving, Communication",0.7177
"Analytical Thinking, Effective Communication, Teamwork, Conflict Resolution","Patience, Conflict Resolution, Mentorship",0.6439
"Leadership, Coaching, Public Speaking, Analytical Thinking, Conflict Resolution","Teamwork, Team Collaboration, Coaching, Negotiation, Leadership",0.823
"Analytical Thinking, Work Ethic, Interpersonal Skills, Teamwork","Mentorship, Public Speaking, Creativity, Confidence, Empathy, Work Ethic",0.3849
"Negotiation, Decision Making, Conflict Resolution, Empathy, Analytical Thinking, Problem Solving","Patience, Conflict Resolution, Coaching, Creativity",0.6308
"Leadership, Coaching, Emotional Intelligence, Interpersonal Skills, Critical Thinking, Stress Management","Collaboration, Conflict Resolution, Decision Making",0.5275
"Leadership, Adaptability, Active Listening, Stress Management, Time Management","Coaching, Effective Communication, Patience",0.8285
"Coaching, Networking, Negotiation","Networking, Interpersonal Skills, Problem Solving, Collaboration",0.3788
"Collaboration, Communication, Patience, Effective Communication","Coaching, Stress Management, Public Speaking, Patience",0.374
"Team Collaboration, Communication, Decision Making, Analytical Thinking, Work Ethic","Teamwork, Conflict Resolution, Leadership, Communication, Interpersonal Skills, Problem Solving",0.4101
"Teamwork, Confidence, Creativity, Emotional Intelligence, Coaching, Interpersonal Skills","Analytical Thinking, Active Listening, Time Management, Leadership, Problem Solving",0.1814
"Conflict Resolution, Active Listening, Analytical Thinking","Interpersonal Skills, Effective Communication, Mentorship, Communication, Work Ethic",0.4211
"Empathy, Critical Thinking, Work Ethic","Creativity, Stress Management, Emotional Intelligence",0.3861
"Decision Making, Teamwork, Time Management, Critical Thinking, Stress Management","Work Ethic, Confidence, Decision Making, Conflict Resolution, Creativity, Public Speaking",0.5226
"Mentorship, Decision Making, Public Speaking, Analytical Thinking, Emotional Intelligence","Time Management, Active Listening, Effective Communication",0.5513
"Leadership, Decision Making, Problem Solving, Teamwork, Confidence, Empathy","Teamwork, Active Listening, Team Collaboration, Mentorship, Stress Management, Conflict Resolution",0.7814
"Analytical Thinking, Active Listening, Emotional Intelligence, Decision Making","Effective Communication, Time Management, Teamwork, Creativity, Negotiation",0.6426
"Patience, Communication, Interpersonal Skills, Problem Solving","Networking, Patience, Team Collaboration, Interpersonal Skills",0.4135
"Creativity, Negotiation, Confidence","Effective Communication, Patience, Coaching, Critical Thinking, Communication, Empathy",0.3652
"Stress Management, Interpersonal Skills, Patience, Adaptability, Work Ethic, Decision Making","Active Listening, Critical Thinking, Creativity, Analytical Thinking, Collaboration",0.5738
"Critical Thinking, Conflict Resolution, Confidence, Problem Solving, Adaptability, Negotiation","Team Collaboration, Teamwork, Active Listening, Work Ethic, Empathy",0.302
"Adaptability, Collaboration, Critical Thinking, Public Speaking","Creativity, Team Collaboration, Collaboration, Critical Thinking",0.7747
"Leadership, Teamwork, Negotiation","Communication, Stress Management, Problem Solving, Interpersonal Skills, Team Collaboration, Collaboration",0.6769
"Critical Thinking, Stress Management, Time Management, Team Collaboration","Decision Making, Stress Management, Confidence, Team Collaboration, Coaching, Problem Solving",0.4296
"Networking, Creativity, Empathy, Conflict Resolution, Adaptability, Effective Communication","Emotional Intelligence, Leadership, Communication, Stress Management, Adaptability",0.243
"Stress Management, Collaboration, Empathy","Problem Solving, Patience, Negotiation, Decision Making",0.7031
"Effective Communication, Patience, Interpersonal Skills","Networking, Active Listening, Effective Communication, Communication",0.4828
"Collaboration, Networking, Team Collaboration, Communication, Negotiation","Coaching, Problem Solving, Adaptability, Time Management, Interpersonal Skills, Confidence",0.6857
"Interpersonal Skills, Confidence, Stress Management, Team Collaboration, Patience","Confidence, Active Listening, Analytical Thinking, Conflict Resolution, Teamwork, Emotional Intelligence",0.2608
"Problem Solving, Communication, Empathy","Teamwork, Stress Management, Work Ethic, Empathy, Decision Making, Conflict Resolution",0.4101
"Communication, Emotional Intelligence, Leadership, Critical Thinking","Stress Management, Mentorship, Problem Solving, Time Management, Communication, Leadership",0.5008
"Mentorship, Decision Making, Communication","Time Management, Problem Solving, Mentorship, Stress Management, Work Ethic, Teamwork",0.507
"Teamwork, Effective Communication, Empathy, Creativity, Conflict Resolution, Decision Making","Collaboration, Empathy, Coaching, Time Management",0.4325
"Collaboration, Analytical Thinking, Critical Thinking, Adaptability","Analytical Thinking, Stress Management, Interpersonal Skills, Communication, Emotional Intelligence",0.5934
"Critical Thinking, Negotiation, Time Management, Teamwork, Analytical Thinking, Team Collaboration","Problem Solving, Effective Communication, Team Collaboration, Stress Management",0.3399
"Problem Solving, Emotional Intelligence, Negotiation, Teamwork, Empathy","Emotional Intelligence, Negotiation, Problem Solving",0.4786
"Analytical Thinking, Confidence, Negotiation, Adaptability, Critical Thinking","Time Management, Adaptability, Collaboration, Critical Thinking, Teamwork",0.518
"Emotional Intelligence, Collaboration, Work Ethic","Decision Making, Creativity, Empathy, Communication, Patience, Teamwork",0.5772
"Emotional Intelligence, Confidence, Communication, Decision Making, Interpersonal Skills, Analytical Thinking","Adaptability, Conflict Resolution, Problem Solving, Time Management, Effective Communication",0.6067
"Creativity, Leadership, Stress Management","Effective Communication, Public Speaking, Mentorship, Patience, Teamwork",0.3313
"Confidence, Empathy, Conflict Resolution","Creativity, Confidence, Negotiation, Analytical Thinking, Collaboration, Work Ethic",0.2699
"Communication, Negotiation, Emotional Intelligence","Stress Management, Problem Solving, Emotional Intelligence, Mentorship, Collaboration",0.6917
"Public Speaking, Leadership, Critical Thinking, Communication","Leadership, Mentorship, Teamwork, Communication, Decision Making",0.5498
"Leadership, Effective Communication, Conflict Resolution, Mentorship, Patience, Networking","Public Speaking, Decision Making, Team Collaboration",0.3877
"Problem Solving, Mentorship, Patience","Confidence, Communication, Stress Management, Public Speaking, Leadership",0.7327
"Effective Communication, Work Ethic, Coaching, Public Speaking, Leadership","Adaptability, Effective Communication, Coaching, Problem Solving, Team Collaboration",0.5174
"Critical Thinking, Leadership, Teamwork","Team Collaboration, Confidence, Decision Making, Stress Management, Work Ethic, Problem Solving",0.6769
"Critical Thinking, Leadership, Networking, Analytical Thinking, Communication, Conflict Resolution","Time Management, Patience, Conflict Resolution, Networking",0.5101
"Coaching, Interpersonal Skills, Critical Thinking, Teamwork, Problem Solving, Patience","Time Management, Interpersonal Skills, Negotiation, Coaching",0.8091
"Work Ethic, Active Listening, Creativity","Team Collaboration, Work Ethic, Stress Management",0.7633
"Active Listening, Negotiation, Emotional Intelligence, Creativity, Communication","Public Speaking, Time Management, Patience, Problem Solving",0.4627
"Adaptability, Leadership, Coaching","Adaptability, Creativity, Coaching, Teamwork, Emotional Intelligence",0.6457
"Public Speaking, Stress Management, Active Listening","Critical Thinking, Effective Communication, Confidence",0.5968
"Interpersonal Skills, Active Listening, Creativity","Adaptability, Interpersonal Skills, Empathy, Conflict Resolution, Emotional Intelligence, Leadership",0.7053
"Empathy, Negotiation, Stress Management, Adaptability, Decision Making, Emotional Intelligence","Active Listening, Work Ethic, Networking, Effective Communication",0.3553
"Critical Thinking, Effective Communication, Communication, Active Listening, Problem Solving, Coaching","Conflict Resolution, Creativity, Critical Thinking",0.6029
"Conflict Resolution, Negotiation, Interpersonal Skills, Empathy","Empathy, Confidence, Analytical Thinking, Decision Making, Conflict Resolution",0.6588
"Emotional Intelligence, Problem Solving, Negotiation","Team Collaboration, Empathy, Leadership",0.2362
"Critical Thinking, Mentorship, Public Speaking, Coaching, Collaboration, Creativity","Mentorship, Work Ethic, Negotiation, Empathy, Networking, Communication",0.3225
"Effective Communication, Adaptability, Coaching","Collaboration, Patience, Networking",0.1941
"Decision Making, Public Speaking, Collaboration, Negotiation, Analytical Thinking, Communication","Creativity, Teamwork, Coaching, Team Collaboration",0.4596
"Collaboration, Patience, Stress Management, Effective Communication","Negotiation, Coaching, Mentorship, Leadership",0.6076
"Adaptability, Communication, Team Collaboration","Interpersonal Skills, Coaching, Confidence, Adaptability, Time Management",0.7254
"Work Ethic, Time Management, Empathy","Active Listening, Networking, Negotiation, Leadership, Effective Communication, Work Ethic",0.5111
"Interpersonal Skills, Networking, Collaboration, Effective Communication","Work Ethic, Critical Thinking, Leadership, Interpersonal Skills, Creativity",0.7443
"Communication, Effective Communication, Time Management","Negotiation, Empathy, Team Collaboration, Analytical Thinking, Networking",0.293
"Patience, Coaching, Negotiation, Public Speaking, Problem Solving","Work Ethic, Negotiation, Confidence",0.2445
"Leadership, Work Ethic, Interpersonal Skills","Negotiation, Leadership, Emotional Intelligence",0.4917
"Conflict Resolution, Patience, Public Speaking","Coaching, Time Management, Leadership, Creativity, Active Listening, Networking",0.5576
"Decision Making, Adaptability, Patience, Public Speaking","Coaching, Stress Management, Conflict Resolution, Interpersonal Skills, Creativity, Empathy",0.4951
"Problem Solving, Effective Communication, Communication, Active Listening, Creativity","Time Management, Empathy, Decision Making",0.1899
"Mentorship, Collaboration, Creativity, Empathy","Emotional Intelligence, Networking, Stress Management",0.4866
"Analytical Thinking, Team Collaboration, Decision Making, Stress Management, Interpersonal Skills, Creativity","Stress Management, Time Management, Active Listening",0.3043
"Creativity, Negotiation, Communication, Work Ethic","Decision Making, Work Ethic, Stress Management",0.6005
"Team Collaboration, Stress Management, Problem Solving, Confidence, Networking, Critical Thinking","Analytical Thinking, Networking, Leadership",0.555
"Decision Making, Team Collaboration, Communication, Active Listening","Conflict Resolution, Collaboration, Active Listening, Critical Thinking",0.359
"Critical Thinking, Analytical Thinking, Problem Solving, Leadership","Public Speaking, Coaching, Time Management, Team Collaboration, Confidence, Networking",0.4229
"Analytical Thinking, Teamwork, Effective Communication, Leadership, Emotional Intelligence, Creativity","Confidence, Teamwork, Conflict Resolution, Networking, Emotional Intelligence",0.3411
"Team Collaboration, Networking, Patience","Coaching, Adaptability, Problem Solving, Communication, Effective Communication",0.4906
"Networking, Active Listening, Confidence, Empathy, Public Speaking","Coaching, Emotional Intelligence, Team Collaboration, Decision Making",0.6433
"Patience, Creativity, Team Collaboration, Interpersonal Skills, Negotiation","Analytical Thinking, Decision Making, Networking, Time Management",0.3521
"Negotiation, Networking, Patience, Teamwork, Analytical Thinking, Communication","Patience, Communication, Time Management, Team Collaboration, Coaching",0.5756
"Decision Making, Time Management, Creativity, Problem Solving, Team Collaboration","Problem Solving, Decision Making, Teamwork, Creativity",0.4205
"Negotiation, Mentorship, Empathy, Patience, Active Listening, Decision Making","Stress Management, Decision Making, Adaptability, Team Collaboration, Coaching",0.3811
"Negotiation, Work Ethic, Collaboration, Critical Thinking, Analytical Thinking, Problem Solving","Stress Management, Confidence, Networking, Active Listening, Patience, Time Management",0.4839
"Adaptability, Coaching, Team Collaboration","Critical Thinking, Communication, Team Collaboration, Mentorship",0.3447
"Conflict Resolution, Team Collaboration, Time Management, Analytical Thinking","Public Speaking, Time Management, Networking, Problem Solving, Conflict Resolution, Team Collaboration",0.417
"Patience, Analytical Thinking, Team Collaboration, Creativity","Negotiation, Adaptability, Decision Making",0.3203
"Collaboration, Mentorship, Emotional Intelligence, Public Speaking, Team Collaboration","Creativity, Mentorship, Teamwork, Negotiation, Decision Making, Public Speaking",0.7947
"Networking, Collaboration, Patience","Conflict Resolution, Work Ethic, Team Collaboration, Patience, Networking, Creativity",0.5053
"Problem Solving, Critical Thinking, Networking, Empathy","Collaboration, Negotiation, Decision Making, Effective Communication, Conflict Resolution, Networking",0.395
"Analytical Thinking, Empathy, Team Collaboration, Emotional Intelligence","Critical Thinking, Stress Management, Coaching",0.5321
"Analytical Thinking, Collaboration, Leadership","Teamwork, Team Collaboration, Adaptability, Emotional Intelligence, Negotiation, Work Ethic",0.4832
"Empathy, Interpersonal Skills, Networking, Leadership, Communication, Problem Solving","Collaboration, Communication, Adaptability, Critical Thinking, Confidence, Conflict Resolution",0.4669
"Interpersonal Skills, Collaboration, Active Listening, Adaptability","Decision Making, Public Speaking, Confidence, Coaching, Empathy, Critical Thinking",0.5921
"Active Listening, Emotional Intelligence, Time Management, Collaboration, Team Collaboration","Active Listening, Leadership, Communication, Analytical Thinking, Decision Making",0.6136
"Collaboration, Effective Communication, Active Listening","Stress Management, Confidence, Time Management",0.4204
"Team Collaboration, Empathy, Stress Management, Communication","Analytical Thinking, Coaching, Communication, Empathy",0.4136
"Team Collaboration, Interpersonal Skills, Conflict Resolution, Analytical Thinking","Conflict Resolution, Communication, Collaboration, Leadership, Patience, Mentorship",0.4587
"Teamwork, Problem Solving, Work Ethic, Effective Communication, Stress Management, Negotiation","Patience, Active Listening, Teamwork, Communication, Networking",0.1547
"Time Management, Networking, Patience","Creativity, Coaching, Adaptability, Time Management, Effective Communication, Work Ethic",0.2727
"Effective Communication, Problem Solving, Teamwork, Adaptability","Problem Solving, Analytical Thinking, Conflict Resolution, Emotional Intelligence, Public Speaking",0.705
"Work Ethic, Decision Making, Active Listening","Active Listening, Analytical Thinking, Communication, Time Management",0.7467
"Conflict Resolution, Time Management, Collaboration, Leadership","Emotional Intelligence, Mentorship, Collaboration, Coaching, Analytical Thinking",0.4626
"Stress Management, Empathy, Mentorship, Coaching","Work Ethic, Creativity, Effective Communication, Decision Making",0.5865
"Analytical Thinking, Empathy, Confidence, Coaching","Conflict Resolution, Effective Communication, Coaching, Patience, Public Speaking",0.5467
"Patience, Stress Management, Work Ethic","Effective Communication, Time Management, Stress Management, Interpersonal Skills, Collaboration, Mentorship",0.9618
"Work Ethic, Adaptability, Public Speaking, Patience","Confidence, Time Management, Conflict Resolution, Stress Management, Adaptability, Emotional Intelligence",0.6679
"Negotiation, Problem Solving, Conflict Resolution","Team Collaboration, Decision Making, Work Ethic",0.4808
"Analytical Thinking, Conflict Resolution, Work Ethic, Mentorship, Patience","Conflict Resolution, Interpersonal Skills, Critical Thinking, Work Ethic, Patience",0.3567
"Coaching, Confidence, Analytical Thinking, Empathy, Creativity","Work Ethic, Empathy, Coaching, Communication, Negotiation, Stress Management",0.259
"Teamwork, Leadership, Decision Making","Decision Making, Creativity, Analytical Thinking",0.5305
"Networking, Effective Communication, Public Speaking","Mentorship, Team Collaboration, Negotiation, Public Speaking, Interpersonal Skills, Time Management",0.3865
"Negotiation, Patience, Leadership, Analytical Thinking, Interpersonal Skills","Collaboration, Conflict Resolution, Effective Communication, Work Ethic, Time Management, Confidence",0.2867
"Communication, Time Management, Networking, Mentorship, Teamwork, Stress Management","Communication, Team Collaboration, Negotiation, Patience, Problem Solving",0.403
"Time Management, Work Ethic, Networking, Adaptability, Active Listening","Empathy, Coaching, Emotional Intelligence, Collaboration, Negotiation",0.3378
"Coaching, Interpersonal Skills, Time Management","Patience, Empathy, Stress Management, Communication",0.7531
"Interpersonal Skills, Mentorship, Emotional Intelligence, Work Ethic, Team Collaboration","Communication, Confidence, Creativity, Mentorship, Analytical Thinking",0.6322
"Collaboration, Active Listening, Teamwork, Effective Communication, Decision Making, Conflict Resolution","Stress Management, Public Speaking, Emotional Intelligence, Coaching",0.4988
"Communication, Team Collaboration, Public Speaking, Creativity, Coaching","Coaching, Negotiation, Decision Making",0.722
"Teamwork, Decision Making, Work Ethic, Adaptability, Effective Communication","Decision Making, Time Management, Empathy, Effective Communication",0.5116
"Adaptability, Active Listening, Networking, Conflict Resolution, Empathy, Patience","Decision Making, Empathy, Active Listening",0.3708
"Public Speaking, Critical Thinking, Effective Communication, Work Ethic, Decision Making, Interpersonal Skills","Critical Thinking, Networking, Decision Making, Communication",0.7285
"Coaching, Public Speaking, Active Listening, Effective Communication","Effective Communication, Adaptability, Mentorship, Negotiation",0.5808
"Team Collaboration, Stress Management, Coaching, Collaboration, Active Listening, Problem Solving","Active Listening, Leadership, Critical Thinking",0.3444
"Patience, Effective Communication, Stress Management, Negotiation, Decision Making, Emotional Intelligence","Adaptability, Interpersonal Skills, Confidence",0.4714
"Stress Management, Work Ethic, Analytical Thinking, Patience, Mentorship","Negotiation, Teamwork, Collaboration, Conflict Resolution",0.3687
"Creativity, Stress Management, Conflict Resolution, Patience, Public Speaking, Adaptability","Interpersonal Skills, Critical Thinking, Analytical Thinking",0.2926
